タイトル,サークル名,発行者,発行年,ジャンル作品,ジャンル癖,サイズ
精処理覚えたてふたなりちんちんで無双しているせるふを絶対に止めて見せる,もちもちブルドーザー部,しゅぽーん,2023/8/6,DIY,ふたなり,B5
up! VOL.1,モルテンクラブ,あらいずみるい,1985/8/11,オリジナル,-,B5
RAPE THE PLATONIC Part3,ラインの守り商会,曲芸的自慰者,1986/8/10,アニパロ,-,B5
カズサに生えた。(生やした),りゅうせゐ園,やらゐ,2023/12/30,ブルーアーカイブ,ふたなり,B5
ビュルーアーイクイクVol.1快楽陰茎編,りゅうせゐ園,syoya,2023/12/30,オリジナル,ふたなり,A5
ふたなり特濃ミルクサーバー5,ルート十二面体,ランドルトたまき,2017/2/12,オリジナル,ふたなり,B5
ふたなり特濃ミルクサーバー7,ルート十二面体,ランドルトたまき,2017/11/11,オリジナル,ふたなり,B5
ふたなり特濃ミルクサーバー8,ルート十二面体,ランドルトたまき,2018/11/23,オリジナル,ふたなり,B5
たまつきふたがヤラれるほん3,ろぜったすとーん,ててるん,2018/11/23,オリジナル,ふたなり,B5
ろくろの回し者のラクガキ帳,ロリコンクリニック,ろくろの回し者,2023/8/8,オリジナル,-,B5
ろくろの回し者のラクガキ帳その2,ロリコンクリニック,ろくろの回し者,2023/12/31,オリジナル,-,B5
WASANBON VOL.8,わさんぼん,wa,2017/8/13,艦これ,-,B5
尻型重巡と一緒にお風呂,ワトサト,杉浦線,2014/12/29,艦これ,もがみん,B5
ロマンチック・ランサー,愛味亭,愛味亭うまみ,2018/11/23,FGO,ふたなり,B5
このあとふたなり娘にめちゃくちゃ逆ア〇ルされる,愛味亭,愛味亭うまみ,2019/12/30,オリジナル,ふたなり,B5
ハリガネモガミン,暗黒暴走組,アイヌマニア,2019/8/12,艦これ,もがみん,B5
稲荷屋さんちのまぜ本!ぐだぐだオブワイルド,稲荷屋,稲荷,2017/4/30,FGO,ゼルダ,B5
わるいこミカはおしおきされたい,陰謀の帝国,印カ・オブ・デッド,2023/5/7,ブルーアーカイブ,-,B5
ヲタ子さんVSスノーボウ,横島ん家,Ash横島,2019/8/11,オリジナル,ふたなり,B5
FUTAqours side-You,火愚夜姫工房,月下火愚夜姫,2018/8/12,ラブライブ,ふたなり,B5
我が鎮守府はマイクロビキニを採用しました,開栓注意,篤屋工業,2016/8/13,艦これ,-,B5
ドイツ艦と子作りしよう,開栓注意,篤屋工業,2016/12/29,艦これ,-,B5
コハルフタナル,核座頭,核座頭,2023/12/31,ブルーアーカイブ,ふたなり,B5
突然炎がごとく第二版,革命政府広報室,ラヂヲヘッド,2017/9/3,アイドルマスター,ふたなり,B5
モテないしガマンするのやめる,革命政府広報室,ラヂヲヘッド,2019/10/20,わたモテ,ふたなり,B5
夢見りあむふたなり炎上配信,革命政府広報室,ラヂヲヘッド,2022/8/14,アイドルマスター,ふたなり,B5
ぼっき・ざ・でぃっく!,革命政府広報室,ラヂヲヘッド,2023/12/31,ぼっち・ざ・ろっく!,ふたなり,B5
主将は練習がしたい!,関西オレンジ,荒井啓,2018/12/31,メジャー2,-,B5
ZARAX,魚ウサ王国,魚ウサ王,2016/12/29,艦これ,-,B5
POLAX,魚ウサ王国,魚ウサ王,2017/8/11,艦これ,-,B5
ザラとポーラのへべれけないと,魚ウサ王国,魚ウサ王,2017/8/11,艦これ,-,B5
皇帝特権EX,極彩色,彩社長,2017/4/30,Fate,ふたなり,B5
あざやか,空中線,マキオ,2019/12/29,艦これ,赤城,B5
SuperLative!,空中線,マキオ,2021/2/14,艦これ,もがみん,B5
シャララ,空中線,マキオ,2021/11/21,艦これ,もがみん,B5
ほんもの,空中線,マキオ,2022/12/30,艦これ,沖波,B5
セーラー 艦これ漫画短編集,空中線,マキオ,2023/8/12,艦これ,もがみん,B5
ADVENTURE,空中線,マキオ,2023/12/30,ガンダム,水星・ニカ,B5
Fantazio KAJ Realo 5&6合併号,幻想プロジェクト,幻想プロジェクト,1987/3/15,ガンダム,-,B5
逆境(ルーミ),御機械屋,OMECHA,1995/8/20,ギャラクシーファイト,-,B5
ブルアカふたなり合同,合同,伊巻てん,2023/8/12,ブルーアーカイブ,ふたなり,B5
サブマリン707RX,黒汐物産,岡昌平,2004/8/14,サブマリン707,-,B5
郵便受けにネズみだの虫だの死骸入れるのやめろっつってんだろ!!,紙魚丸製作所,紙魚丸,2024/2/12,ヤニねこ,-,B5
Re:ゼロから始める異世界イチャラブ結婚生活,紙切ればさみ,やすゆき,2016/8/14,Reゼロから始める異世界生活,-,B5
ふぇちこれ04,自宅vacation,うるりひ,2016/8/14,艦これ,浜風,B5
ロッテにお尻弄られる本,七面楚歌,すたーきー,2011/8/14,ロッテのおもちゃ,-,A5
ピンクの悪魔にお尻弄られる本,七面楚歌,すたーきー,2018/11/23,GGO,ふたなり,B5
上野さんにお尻弄られる本,七面楚歌,すたーきー,2019/8/11,上野さんは不器用,ふたなり,B5
くろしおおふろとりっぷ,捨八secの彼方(じゅっぱーせくのかなた),五月猫,2016/12/29,艦これ,-,B5
爆弾ピエロ,樹莱里,樹莱里,2001/7/1,エスプレイド,-,B5
出会った記憶なんてなかった,熟成角砂糖,sugarBt,2021/12/30,プリキュア,ふたなり,B5
姦これ鎮守府轟沈,小判屋,さめだ小判,2014/8/17,艦これ,-,B5
最上と秘密の温泉旅行,小判屋,さめだ小判,2016/8/14,艦これ,もがみん,B5
承認欲求,焼きトリ定食,トリヤロウ,2022/12/31,ぼっち・ざ・ろっく!,ふたなり,B5
欲求不満,焼きトリ定食,トリヤロウ,2023/3/18,ぼっち・ざ・ろっく!,ふたなり,B5
催淫絶頂,焼きトリ定食,トリヤロウ,2023/8/13,ぼっち・ざ・ろっく!,ふたなり,B5
フタユウカアーカイブ,焼きトリ定食,トリヤロウ,2024/1/20,ブルーアーカイブ,ふたなり,B5
ニムちゃんは四六時中構われたい,常時無常,篠塚譲二,2017/4/30,艦これ,-,B5
AUUUUUUN!,常時無常,篠塚譲二,2019/4/29,アリスギア,-,B5
の裏,新井カズキ,新井カズキ,2016/12/31,ガールズアンドパンツァー,ふたなり,B5
エリタマ,真珠貝,武田弘光,2014/8/17,ラブライブ,エリチ,B5
彼方ちゃんと陰茎付侑ちゃん,酢飯部,酢飯部,2022/7/10,ニジガク,ふたなり,B5
改淫懲悪みるきぃぽぷら,水中ホワイト,かるぴ,2018/8/12,オリジナル,ふたなり,B5
ふたなり解像されちゃう弊カルデア,水中ホワイト,かるぴ,2018/12/31,FGO,ふたなり,B5
ふたなり解像されちゃう弊カルデア2,水中ホワイト,かるぴ,2019/12/30,FGO,ふたなり,B5
TINPO ILLUSTRATION,水密桃工房,モモの水道水,2018/6/9,アイドルマスター,ふたなり,B5
雪ちんぽ ふたなり雪歩と律子がレッスンする本,水密桃工房,モモの水道水,2018/8/12,アイドルマスター,ふたなり,B5
雪ちんぽ ふたなり雪歩と亜美真美が秘密の特訓する本,水密桃工房,モモの水道水,2018/12/31,アイドルマスター,ふたなり,B5
雪ちんぽ ほろ酔いあずささんがふたなり雪歩とえっちする本,水密桃工房,モモの水道水,2019/8/11,アイドルマスター,ふたなり,B5
ある日突然ふたなりになったらPhase1,水密桃工房,モモの水道水,2019/11/24,オリジナル,ふたなり,B5
雪ちんぽ ふたなり雪歩が暴走して伊織とえっちしちゃう本,水密桃工房,モモの水道水,2019/12/30,アイドルマスター,ふたなり,B5
アイドルふたなり化スイッチ,水密桃工房,モモの水道水,2020/7/28,アイドルマスター,ふたなり,B5
雪ちんぽ ふたなり雪歩のにおいでやよいがトリップしちゃう本,水密桃工房,モモの水道水,2022/12/31,アイドルマスター,ふたなり,B5
双成寺女学園学内レポート,水密桃工房,モモの水道水,2023/5/4,オリジナル,ふたなり,B5
搾雪 ふたなり雪歩が搾られる本,水密桃工房,モモの水道水,2023/8/13,アイドルマスター,ふたなり,B5
双成寺女学園 交戦,水密桃工房,モモの水道水,2023/12/31,オリジナル,ふたなり,B5
駆逐艦船体検査提督所見報告書,青春カツサンド,かっさんどら,2015/12/30,艦これ,-,B5
巡洋艦船体検査提督所見報告書,青春カツサンド,かっさんどら,2016/12/29,艦これ,-,B5
戦艦空母船体検査提督所見報告書,青春カツサンド,かっさんどら,2017/12/29,艦これ,-,B5
ふたなりっこエンジェルオーバーキル,青葉Q魔洞,双葉淀夢,2017/5/3,オリジナル,ふたなり,B5
ふたまん! 放課後射精スケッチ,青葉Q魔洞,双葉淀夢,2017/11/11,オリジナル,ふたなり,B5
パンツァーハイのおさめかた3,青葉Q魔洞,双葉淀夢,2017/12/31,ガールズアンドパンツァー,ふたなり,B5
ふたまん! 2 真夜中のふたなりガール ,青葉Q魔洞,双葉淀夢,2018/6/9,オリジナル,ふたなり,B5
ふたなりっこサキュバスラブリーデイズ,青葉Q魔洞,双葉淀夢,2018/8/12,オリジナル,ふたなり,B5
パンツァーハイのおさめかた4,青葉Q魔洞,双葉淀夢,2018/11/23,ガールズアンドパンツァー,ふたなり,B5
ASLO1PLUS,千夜茶房,α・アルフライラ,2007/2/22,オリジナル,ふたなり,B5
ふたなりっ!4準備号,全日本生えてる會,ケミガワ,2017/5/3,オリジナル,ふたなり,B5
SHOOTING STAR Vol.1,創作同人流星群,梶慧,1986/6/14,オリジナル,-,B5
それなに…!?,村井村,村井村,2022/8/14,スローループ,ふたなり,B5
うちの子たちは可愛い!!,堕落園,みどりの,2023/12/31,オリジナル,-,B5
Record&Recording,台北人,虫原,2022/9/25,リコリスリコイル,ふたなり,A5
Surprise&Seduce,台北人,虫原,2022/12/31,リコリスリコイル,ふたなり,A5
大人のおもちゃ8巻 双葉のお話,大人のおもちゃ,楊広川,2018/9/22,オリジナル,ふたなり,B5
万引きJK生けいおん部,蛸壷屋,蛸壷屋,2009/8/16,けいおん,-,B5
これ本当にマッサージなんですか!?,中部漫団,重荷路無線,2022/12/31,オリジナル,-,B5
おん・ざ・ろっく!,中部漫団,重荷路無線,2023/8/13,ぼっち・ざ・ろっく!,-,B5
女の子たちのひみつの冒険,超斬開,TERてあ,2020/12/29,ポケモン,-,B5
女の子たちのひみつの冒険2,超斬開,TERてあ,2021/5/29,ポケモン,-,B5
女の子たちのひみつの冒険3,超斬開,TERてあ,2022/2/12,ポケモン,-,B5
女の子たちのいにしえの冒険,超斬開,TERてあ,2022/9/11,ポケモン,-,B5
オナホ売りの少女,超斬開,TERてあ,2023/12/31,オリジナル,-,B5
21号改造計画,超時空要塞カチューシャ,電気将軍,2018/8/12,ドラゴンボール,ふたなり,B5
最上とイチャイチャ喧嘩ックス!!,適齢期に食中毒,沢村青,2023/12/30,艦これ,最上,B5
落とし穴からの脱出,田中家の鴨,たなかあひる,2023/12/30,葬送のフリーレン,-,B5
好きだ,東村山研究棟,村山東一,2019/12/28,ケムリクサ,-,B5
ふたなりシスター はじめての説教,筒森園,筒森,2021/12/31,オリジナル,ふたなり,B5
おねえちゃんとっギュステでサマバケしたい!,藤屋本店,藤ます,2018/8/12,グランブルーファンタジー,-,B5
アリスと一緒にRPGごっこしましょう,半里プラザ,半里バード,2022/8/16,ブルーアーカイブ,-,B5
私はホシノがいいんだよ!!,半里プラザ,半里バード,2022/12/21,ブルーアーカイブ,-,B5
メス狐は視てしまった。,半里プラザ,半里バード,2023/12/31,ブルーアーカイブ,-,B5
セーラー服MAGAZINE くせになりそぉVol.3,秘密結社M,椎名望亜,1988/5/3,オリジナル,-,B5
せふいい,秒殺狸団,佐伯達也,2016/5/1,魔法少女なんてもういいですから。,-,B5
源さん2,敷島贋具,敷島天気,2009/8/16,かのこん,-,B5
淑女図鑑1,敷島贋具,敷島天気,2010/8/15,れでぃばと,-,B5
レムのエッチな悩みを解決してくださいっ,魔太郎,魔太郎,2016/8/14,Reゼロから始める異世界生活,-,B5
イリヤちゃんを完全同意(さいみん)でママにする本,毎日健康生活,ヘルシーマン,2022/12/31,FGO,-,B5
常夏艦隊,木綿シリコン,川科,2014/8/15,艦これ,もがみん,B5
ツルギだって青春したい,目つき悪い教団,駿河クロイツ,2023/12/31,ブルーアーカイブ,-,B5
ななおのナイショ,夜FUCKERS,ミツギ,2018/12/31,オリジナル,ふたなり,B5
ふたなり霊夢はお金が欲しい!!,余はおかずを所望しておる,しや,2017/10/15,東方,ふたなり,B5
性欲処理長ふたなり咲夜,余はおかずを所望しておる,しや,2017/12/29,東方,ふたなり,B5
早苗と文のヘンタイふたなり密会,余はおかずを所望しておる,しや,2018/8/10,東方,ふたなり,B5
がんばれ椛!文ちゃんのちんぽに負けるな!,余はおかずを所望しておる,しや,2019/5/5,東方,ふたなり,B5
射精させてください咲夜さん!!,余はおかずを所望しておる,しや,2019/8/12,東方,ふたなり,B5
異世界転生したらふたなり勇者様だった件,来世はふたなり美少女,orion,2022/11/3,オリジナル,ふたなり,B5
魔法力強化計画ブレイブブレイク,雷神会,はるきゲにあ,2016/11/20,ストライクウィッチーズ,-,B5
魔法少女催眠パコパコーズ,乱視と君と。,santa,2017/8/13,FGO,-,B5
もこもこXXディフュージョン,流体ユリナアル,流体肉,2021/5/29,プリキュア,-,B5
責任感もほどほどにしてくださいね!,恋愛漫画家,恋愛漫画家,2023/12/30,ガンダム,水星,B5
銃と母乳と吸血鬼2,惑星ノスタルジー,常磐緑,2023/8/13,オリジナル,ふたなり,B5
たまみこ,蒟蒻鍋,magifuro蒟蒻,2017/8/13,オリジナル,ふたなり,B5
ASS掘るフォくん2霊衣開放編,蒟蒻鍋,magifuro蒟蒻,2017/11/11,FGO,ふたなり,B5
めちゃシコしちゃう系女子,蒟蒻鍋,magifuro蒟蒻,2017/12/31,オリジナル,ふたなり,B5
よわよわふたなりサキュバスちゃん01,蒟蒻鍋,magifuro蒟蒻,2018/8/12,オリジナル,ふたなり,B5
ふたなりゆかりさんVSバーチャル空間,蒟蒻鍋,magifuro蒟蒻,2018/11/23,ボイロ,ふたなり,B5
よわよわふたなりサキュバスちゃん02,蒟蒻鍋,magifuro蒟蒻,2018/12/31,オリジナル,ふたなり,B5
よわよわふたなりサキュバスちゃん03,蒟蒻鍋,magifuro蒟蒻,2019/8/11,オリジナル,ふたなり,B5
フタナリミルクティー,蒟蒻鍋,magifuro蒟蒻,2019/9/23,オリジナル,ふたなり,B5
よわよわふたなりサキュバスちゃん04,蒟蒻鍋,magifuro蒟蒻,2019/12/30,オリジナル,ふたなり,B5
乳首が弱いふたなりゆかりさん,蒟蒻鍋,magifuro蒟蒻,2020/2/11,ボイロ,ふたなり,B5
ふたなりオナニズム,蒟蒻鍋,magifuro蒟蒻,2020/11/3,オリジナル,ふたなり,B5
ふたなりちゃんすぐイく,蒟蒻鍋,magifuro蒟蒻,2021/11/21,オリジナル,ふたなり,B5
ふたなり娘はスッキリしたい,蒟蒻鍋,magifuro蒟蒻,2022/11/3,オリジナル,ふたなり,B5
ふたなりちんちんの陳情,蒟蒻鍋,magifuro蒟蒻,2023/5/4,オリジナル,ふたなり,B5
なかなかイけないふたなり娘,蒟蒻鍋,magifuro蒟蒻,2023/8/13,オリジナル,ふたなり,B5
ふたなり娘と男の娘がイチャラブする話,蒟蒻鍋,magifuro蒟蒻,2023/10/9,オリジナル,ふたなり,B5
ふたなり娘はいつもとちがう,蒟蒻鍋,magifuro蒟蒻,2023/12/31,オリジナル,ふたなり,B5
