タイトル,サークル名,発行者,発行年,ジャンル1,ジャンル2,サイズ
ごこく出発までのある1コマ。①,東村山研究棟,村山東一,2017/8/27,けものフレンズ,-,B5
イデザブダン,ウメグラ系,梅野隆児,2022/12/30,富野,アンソロ,B5
「7」～JULY～スパイシー大作戦7 8版,スパイシー大作戦,氷川へきる,2024/1/21,こみパ,-,B5
16bitセンセーション,CUT A DUSH!!,若木民喜,2016/12/31,オリジナル,-,B5
16bitセンセーション2,CUT A DUSH!!,若木民喜,2017/8/11,オリジナル,-,B5
16bitセンセーション3,CUT A DUSH!!,若木民喜,2017/12/31,オリジナル,-,B5
16bitセンセーション4,CUT A DUSH!!,若木民喜,2018/8/12,オリジナル,-,B5
16bitセンセーション5,CUT A DUSH!!,若木民喜,2018/12/31,オリジナル,-,B5
16bitセンセーション6,CUT A DUSH!!,若木民喜,2019/8/11,オリジナル,-,B5
16bitセンセーション6_2,CUT A DUSH!!,若木民喜,2019/12/30,オリジナル,-,B5
16bitセンセーション7,CUT A DUSH!!,若木民喜,2021/12/31,オリジナル,-,B5
16bitセンセーション8,CUT A DUSH!!,若木民喜,2023/8/13,オリジナル,-,B5
16bitセンセーション9,CUT A DUSH!!,若木民喜,2023/10/1,オリジナル,-,B5
16bitセンセーション10,CUT A DUSH!!,若木民喜,2023/12/31,オリジナル,-,B5
がんばれ同期ちゃん1,よむ書店,よむ,2020/5/1,オリジナル,-,B5
がんばれ同期ちゃん2,よむ書店,よむ,2020/8/14,オリジナル,-,B5
がんばれ同期ちゃん3,よむ書店,よむ,2020/12/30,オリジナル,-,B5
がんばれ同期ちゃん4,よむ書店,よむ,2021/5/1,オリジナル,-,B5
がんばれ同期ちゃん5,よむ書店,よむ,2021/8/14,オリジナル,-,B5
がんばれ同期ちゃん6,よむ書店,よむ,2021/12/30,オリジナル,-,B5
魔性の潮,比村乳業,比村奇石,2014/12/29,艦これ,-,B5
月曜日のたわわ,比村乳業,比村奇石,2015/12/31,オリジナル,-,B5
月曜日のたわわ2,比村乳業,比村奇石,2016/8/14,オリジナル,-,B5
月曜日のたわわ3,比村乳業,比村奇石,2016/12/31,オリジナル,-,B5
月曜日のたわわ4,比村乳業,比村奇石,2017/8/11,オリジナル,-,B5
月曜日のたわわ5,比村乳業,比村奇石,2017/12/31,オリジナル,-,B5
月曜日のたわわ6,比村乳業,比村奇石,2018/8/12,オリジナル,-,B5
月曜日のたわわ7,比村乳業,比村奇石,2018/12/31,オリジナル,-,B5
月曜日のたわわ8,比村乳業,比村奇石,2019/8/12,オリジナル,-,B5
月曜日のたわわ9,比村乳業,比村奇石,2019/12/31,オリジナル,-,B5
月曜日のたわわEXTRA,比村乳業,比村奇石,2020/5/5,オリジナル,-,B5
月曜日のたわわ10,比村乳業,比村奇石,2020/12/30,オリジナル,-,B5
月曜日のたわわ11,比村乳業,比村奇石,2021/8/14,オリジナル,-,B5
月曜日のたわわ12,比村乳業,比村奇石,2021/12/31,オリジナル,-,B5
月曜日のたわわ13,比村乳業,比村奇石,2022/8/14,オリジナル,-,B5
月曜日のたわわ14,比村乳業,比村奇石,2022/12/31,オリジナル,-,B5
月曜日のたわわ15,比村乳業,比村奇石,2023/8/14,オリジナル,-,B5
月曜日のたわわ16,比村乳業,比村奇石,2023/12/31,オリジナル,-,B5
友達じゃいられない。,田中家の鴨,たなかあひる,2020/8/8,響けユーフォニアム,-,B5
イヨちゃんと2億4千万のヒトミちゃん,しろくま屋,すか,2017/5/7,艦これ,-,B5
べつに寂しくなんてないのに姉妹がめちゃくちゃかまってくるから大変なんだけど!,アロハニッケル,deco,2021/12/30,艦これ,-,B5
白雪は白雪姫,富士山九合目,みずの,2016/12/29,艦これ,-,B5
用法用量守れません,こるり屋,こるり,2021/12/30,艦これ,-,B5
かんこれ戦記4,雪墨庵,伊藤黒介,2017/12/29,艦これ,-,B5
9th7 ナイスセブン,az+play,赤りんご,2022/5/15,艦これ,-,B5
吾輩はフォウである。,匿名天体,"	鶴",2017/8/13,FGO,-,B5
コハエース2017夏の増刊号,経験値ランド,"	経験値",2017/8/13,FGO,-,B5
我が家のサーヴァント,紅ねじるし,ユウズィ,2016/12/31,FGO,-,B5
カルディアンバスターズ,ななしのや,小雨大豆,2017/12/29,FGO,-,B5
オトマリ,ホープツーワン,二月,2022/9/25,アリスギア,-,B5
YueSoci of the situation!,ブレないつ,四季おり,2023/8/12,グランブルーファンタジー,-,B5
有機制服 #05 夏色セーラーワンピース,かんむりとかげ,つむ,2022/12/31,オリジナル,-,B5
DEEPBLUE,Chokuya,Chokuya,2017/2/12,オリジナル,-,B5
光の君のさがなき計画<藤壺>,ノラネコノタマ,雪野みなと,2017/8/13,オリジナル,ロリ,B5
ポイントレンジ・ラヴ3,スタジオN.BALL,針玉ヒロキ,2016/11/19,オリジナル,-,B5
J's7,牛乳屋さん,牛乳のみお,2017/8/13,オリジナル,-,B5
カンコレーション4,RICKY-TICK,藤井理乃,2016/5/8,艦これ,もがみん,B5
ゴールドシップ風雲録2,雪墨庵,伊藤黒介,2022/8/14,ウマ娘,-,B5
ゴールドシップ風雲録3,雪墨庵,伊藤黒介,2023/8/12,ウマ娘,-,B5
馬場庵,えとかじとか,えとか,2021/12/30,ウマ娘,-,B5
馬場庵2,えとかじとか,えとか,2022/8/14,ウマ娘,-,B5
馬場庵3,えとかじとか,えとか,2022/12/30,ウマ娘,-,B5
馬場庵4,えとかじとか,えとか,2023/5/28,ウマ娘,-,B5
馬場庵5,えとかじとか,えとか,2023/8/12,ウマ娘,-,B5
ウマ ライク・プラシッド,コーヒー飲みすぎ,ビリー,2021/12/30,ウマ娘,-,B5
ウマ ライク・プラシッド ウマーヴェリック,コーヒー飲みすぎ,ビリー,2022/8/14,ウマ娘,-,B5
ウマ ライク・プラシッド メガ・ウマックス,コーヒー飲みすぎ,ビリー,2022/12/30,ウマ娘,-,B5
オールウェイズ・グリーン,木綿シリコン,川科,2022/11/6,ウマ娘,-,B5
UMA MUSUME MATOME,フェザー・クラウン,おかだアンミツ,2022/8/14,ウマ娘,-,B5
The Mobile Police Patlabor,田舎工房,Benny,2020/12/31,ファイブスター物語,-,B5
機動警察パカレイバー,田舎工房,丼ぶりめし,2022/8/13,ウマ娘,-,B5
これが恋だと決めるには速すぎる,あまもりウィークリー,シクシク,2021/11/7,ウマ娘,-,B5
夕暮れの彼方に,あまもりウィークリー,シクシク,2021/9/23,ウマ娘,-,B5
実証 愛情弁当,こるり屋,こるり,2021/12/30,ウマ娘,-,B5
ベラ様、ロナ家やめるってよ!,ハリヤマ,針井,2016/12/30,ガンダム,-,B5
プリチャンごった煮なんだもん!,おろなみん でぃ,犬飼りっぽ,2019/12/28,プリチャン,-,B5
だいたいセーラーふく,まるたぁ小屋,もりちか,2019/12/30,オリジナル,-,B5
制服ときどき犬,まるたぁ小屋,もりちか,2022/8/13,オリジナル,-,B5
JJ(ガンダムZZ),さらば我が友よ,むらたん,2022/8/13,ガンダム,-,B5
日出ずる国の男子会,はぁとふる売国奴,田中圭一,2018/12/29,サンライズ作品,-,B5
男の子が好きなやつをする女の子の本。,真・聖堂☆本舗,聖☆司,2020/10/18,オリジナル,-,B5
碧の落書,CUT A DUSH!!,みつみ美里,2023/5/7,よろず,-,B5
おまけ雑記,CUT A DUSH!!,みつみ美里,2021/12/31,よろず,-,B5
きっとEntrance,鉄棒少年,夏師,2023/3/19,ぼっち・ざ・ろっく!,-,B5
帰ってきたウルトラセブン,STUDIO SCAN,うらべすう,1993/8/16,ウルトラセブン,-,B5
とりあたまくん4,スタジオとりあたまくん,とりあたまくん,1997/7/26,オリジナル,-,B5
His Place Adove Us,内藤泰弘,内藤泰弘,1990/8/8,オリジナル,-,B5
Messe,ぴろしき屋,ぴろしき,1989/12/24,オリジナル,-,B5
