タイトル,サークル名,発行者,発行年,ジャンル作品,ジャンル癖,サイズ
すわショタ01,100円外務省,みりの,2017/8/11,東方,-,B5
すわショタ番外編10 すわ姉ちゃんが近いっ!!,100円外務省,みりの,2017/10/15,東方,-,B5
魔法騎士の白いアレ,70年式悠久機関,おはぎさん,2013/4/28,レイアース,ふたなり,B5
乙女騎士の淫靡ていしょん,70年式悠久機関,おはぎさん,2021/8/28,オリジナル,ふたなり,B5
Hな女子高生つめ,７番の置物,藤鼠,2016/12/31,オリジナル,-,A5
Hな女子高生つめ2,７番の置物,藤鼠,2017/12/31,オリジナル,-,A5
ろり＆ふた8 伊58&呂500,Achoromic,夢双月,2017/5/1,艦これ,ふたなり,B5
ろり＆ふた10 暁&響,Achoromic,夢双月,2018/1/1,艦これ,ふたなり,B5
ろり＆ふた11,Achoromic,夢双月,2018/8/13,プリズマイリヤ,ふたなり,B5
ろり＆ふた13,Achoromic,夢双月,2020/8/2,アイドルマスター,ふたなり,B5
ろり＆ふた12,Achoromic,夢双月,"	2019/01/01",小林さんちのメイドラゴン,ふたなり,B5
恋する乙女は大砲変化!,AGM2研,小黒正巳,1999/8/15,コレクターユイ,-,B5
教師ひとり、生徒ひとり。,Asunaro Neat.,ろんな,2021/12/31,オリジナル,-,B5
TSロリおじさんの冒険 オナニー編,Asunaro Neat.,ろんな,2022/12/31,オリジナル,-,B5
TSロリおじさんの冒険閑話 ふわふわドーム編,Asunaro Neat.,ろんな,2023/8/13,オリジナル,-,B5
TSロリおじさんの冒険閑話 ハンドメイドの章,Asunaro Neat.,ろんな,2023/12/31,オリジナル,-,B5
古書館ウィシュリスト,Ballistic onahole,Б,2022/12/31,ブルーアーカイブ,-,B5
カルデアマニア・黒&白(ジャンヌ),Bear Hand,俺正読,2019/4/14,FGO,ふたなり,B5
カルデアマニア・鬼&魔,Bear Hand,俺正読,2019/4/14,FGO,ふたなり,B5
カルデアマニア・源頼光,Bear Hand,俺正読,2019/8/12,FGO,ふたなり,B5
カルデアマニア・トリオブラウン,Bear Hand,俺正読,2019/8/12,FGO,ふたなり,B5
ま、いっか!,BlueMage,あおいまなぶ,2019/10/20,アリスギア,-,B5
惨状合体ひぐらしGO!,BlueMage,あおいまなぶ,2020/12/20,ひぐらしのなく頃に,-,B5
ウィッ乳,BlueMage,あおいまなぶ,2020/12/27,ストライクウィッチーズ,-,B5
豊穣沙都子ルチーアに咲く,BlueMage,あおいまなぶ,2021/5/23,ひぐらしのなく頃に,-,B5
ほなにー 秋山殿潜入大作戦(失敗),bolze.,○蜜柑,2013/2/17,ガールズアンドパンツァー,-,B5
Izetta mit Schwanz,bolze.,○蜜柑,2017/8/11,終末のイゼッタ,-,B5
ふたりで接待、若おかみ! おっこ・真月編,bolze.,○蜜柑,2018/12/29,若おかみは小学生,-,B5
なこXなこ,C.R's NEST,しーあーる,2018/8/12,サムライスピリッツ,ふたなり,B5
ふたなり剣士シズクの受難 触手鎧編,C.R's NEST,しーあーる,2018/11/23,オリジナル,ふたなり,B5
ふたなり何ガロン射精せる?,C.R's NEST,しーあーる,2019/9/23,ダンベル何キロ持てる?,ふたなり,B5
天使くんレビュアーズ,C.R's NEST,しーあーる,2020/3/21,異種族レビュアーズ,ふたなり,B5
Valkyrie Spear,C.R's NEST,しーあーる,2020/8/8,聖剣伝説,ふたなり,B5
えるゔん ぼう,C.R's NEST,しーあーる,2021/11/21,オリジナル,ふたなり,B5
Cursed Holy Clothes2,C.R's NEST,しーあーる,2022/11/3,ダークアドベント,ふたなり,B5
Lovely Submarin,CHIBIKKO KINGDOM,けこちゃ,2015/8/16,艦これ,潜水艦,B5
梱包少女EX,Clochette,咲良ゆき,2022/12/31,オリジナル,-,B5
ふた娘に悪戯しちゃいけません安藤恵編,Contamination,eigetu,2018/6/17,オリジナル,ふたなり,B5
401染 すべてが白になる日,CrowView,たじ,2016/5/1,艦これ,-,B5
浦波、承りました…,CrowView,たじ,2016/12/31,艦これ,-,B5
お〇ん〇んお掃除しながら元帥タッチ攻略,EASY MODE HEROS,あなくろ,2021/12/30,アズールレーン,ふたなり,B5
バーチャルY〇uTuber娘初雪ちゃんのオナホ実況商品レビュー,EASY MODE HEROS,あなくろ,2021/12/30,艦これ,ふたなり,B5
褐色こくまろ噴乳メイド,GOLD KOMAN SEX,バクシーシAT,2017/8/13,オリジナル,-,B5
FIRE!CRACKER6,HEAVEN'S UNIT,光野けい,1999/5/16,逮捕しちゃうぞ,-,B5
HTSK4.5,HTSK,にしゆき,2016/1/31,グランブルーファンタジー,ふたなり,B5
HTSK9,HTSK,にしゆき,2018/11/23,FGO,ふたなり,B5
M.F.H.H. MP2,In ART THEATER,FRED=KELLY,2003/12/30,みるもDEポン,-,B5
SOLDIER BLUE,INFINITY DRIVE,京極しん,2011/8/14,ストライクウィッチーズ,-,B5
Noblesseoblige ,INFINITY DRIVE,京極しん,2013/4/28,ストライクウィッチーズ,-,B5
Boyish Mellow,INFINITY DRIVE,京極しん,2015/5/2,艦これ,もがみん,B5
MO,INFINITY DRIVE,京極しん,2015/8/16,艦これ,もがみん,B5
日本昔クソ話,K2マンホール,P,2018/8/12,オリジナル,-,B5
モラ活,Lovewn Outpost,BLADE,2021/12/30,原神,-,B5
さよなら迅鯨 忌雷編,M.A.D. WORKS,たむ,2022/8/14,艦これ,-,A5
さよなら迅鯨 発情編,M.A.D. WORKS,たむ,2022/12/30,艦これ,-,A5
さよなら迅鯨 エステ編,M.A.D. WORKS,たむ,2023/8/12,艦これ,-,A5
この星の下で,mirumiru,もみる,2023/3/18,ぼっち・ざ・ろっく!,ふたなり,A5
レムちゃんは発情期,moriQ,森あいり,2016/9/24,Reゼロから始める異世界生活,-,B5
けいじゅん+αぱんつこれくしょん,MtU,MtU,2016/12/29,艦これ,-,B5
じゅうじゅん+αぱんつこれくしょん,MtU,MtU,2017/8/11,艦これ,-,B5
白血球のひみつ,M屋,みこやん,2021/12/31,はたらく細胞,ふたなり,B5
オーガ対ダークエルフ・オーガ繁殖大作戦,M屋,みこやん,2022/8/14,オリジナル,ふたなり,B5
オーガ対ダークエルフⅡ・ラヴラヴ!新婚大作戦,M屋,みこやん,"	2023/08/13",オリジナル,ふたなり,B5
異世界娼館,Naitou2,F4U,2016/8/14,オリジナル,-,B5
搾精ダンジョン攻略に向かない地味子のS級ドスケベステータス,Naitou2,F4U,2021/5/4,オリジナル,-,B5
恋愛禁止の勇者パーティーに向かない地味子のS級ドスケベステータス,Naitou2,F4U,2022/8/14,オリジナル,-,B5
レムの可愛さも鬼がかっている,odin,黒川IZUMI,2016/8/13,Reゼロから始める異世界生活,-,B5
マシュマシュ溢れてきちゃいマシュ,odin,黒川いづみ,2017/4/30,FGO,-,B5
薫冬優子お借りします,OrangeMaru,JP06,2021/8/9,アイドルマスター,-,B5
風の香も,Peθ,もず,2013/12/31,艦これ,もがみん,B5
Halu…,Peθ,もず,2016/12/31,ストライクウィッチーズ,ニパ,B5
MEDICAK DRUNKARD,pinvise,涼月くらら,2013/8/11,宇宙戦艦ヤマト,-,B5
Real Intention,pinvise,涼月くらら,2015/8/16,甘城ブリリアントパーク,-,B5
Sparkling Vacation Homework,pinvise,涼月くらら,2022/10/17,オリジナル,-,B5
鬼方カヨコはこんなことしない。,PTPYworks,シャモナベ,2022/8/14,ブルーアーカイブ,-,B5
惑溺する風信子(ヒヤシンス),PTPYworks,シャモナベ,2022/12/30,ブルーアーカイブ,-,B5
先生は弱いのでアリスが守護ります!,PTPYworks,シャモナベ,2023/8/12,ブルーアーカイブ,-,B5
鬼方カヨコはこんなことしない。2,PTPYworks,シャモナベ,2023/12/30,ブルーアーカイブ,-,B5
チャージングP15,P商会,P商会,1993/12/30,オリジナル,ふたなり,B5
MAO.,RED DRAGON,HASHIBA.H,2002/8/9,-,-,B5
ケダモノフレンズサプライズ,SERVICE HEAVEN,ハヤシ,2017/8/17,けものフレンズ,-,B5
ふたななじみ,SHIS,Zトン,2017/8/13,オリジナル,ふたなり,B5
TRASH BOX3,SNOB NERD WORKS,さめだ小判,2010/12/31,よろず,-,B5
TRASH BOX4,SNOB NERD WORKS,さめだ小判,2012/12/31,よろず,-,B5
姦これ提督が性的な目でしか艦娘を見てくれなくてつらい,SNOB NERD WORKS,さめだ小判,2013/12/31,艦これ,-,B5
結月ゆかりフタナリチンポRTA,Stapspats,翡翠石,2018/8/12,ボイロ,ふたなり,B5
成子坂製作所艶戯録2「怜編」,Studio G-Power!,SASAYUKi,2018/12/31,アリスギア,-,B5
成子坂製作所艶戯録3「チーム:NRtS編」,Studio G-Power!,SASAYUKi,2019/8/12,アリスギア,-,B5
成子坂製作所艶戯録4,Studio G-Power!,SASAYUKi,2019/12/31,アリスギア,-,B5
SAMPLE vol.3,STUDIO SAMPLE,けら,1991/8/16,あさりよしとお,-,B5
SWEET COCONUTS3,STUDIO一喝魔人,ざっくばらん,1993/12/30,本所和子,-,B5
E.C.C.C.M.,sys3.6.3.,ザンクロー,2004/12/30,オリジナル,-,B5
TYPE 1,sys3.6.3.,ザンクロー,2008/8/17,オリジナル,-,B5
TYPE 2 オーディンサーガ アートワークス,sys3.6.3.,ザンクロー,2010/8/16,オリジナル,-,B5
VARIANT PURIFICATION,sys3.6.3.,ザンクロー,2014/12/30,オリジナル,-,B5
VARIANT PURIFICATION2,sys3.6.3.,ザンクロー,2015/8/16,オリジナル,-,B5
VARIANT PURIFICATION3,sys3.6.3.,ザンクロー,2015/12/31,オリジナル,-,B5
PEROPERO CANDY,sys3.6.3.,ザンクロー,2016/8/14,オリジナル,-,B5
TENDER PURIFICATION,sys3.6.3.,ザンクロー,2016/12/31,オリジナル,-,B5
瓜報・2,T2 UNIT,Franken N,1990/12/24,アニパロ,-,B5
艦む寿司,Teaset's,茶器,2017/12/29,艦これ,-,変形
頬の薄紅褪せぬ間に,TUKIBUTO,氷樹一世,2014/8/17,艦これ,蒼龍,B5
TYPE-64a,TYPE-54,Frunbell,2021/11/29,ニジガク,-,B5
TYPE-67a,TYPE-54,Frunbell,2022/10/23,彼女、人見知ります,-,B5
TYPE-68a,TYPE-54,Frunbell,2022/12/30,リコリスリコイル,-,B5
カーテンコールと呼ぶには甘美過ぎた,virophilia,織日ちひろ,2022/9/25,ニジガク,ふたなり,B5
月海の果て,virophilia,織日ちひろ,2022/12/31,ニジガク,ふたなり,B5
発情義妹和泉紗霧開発性活,waterwheel,白田太,2017/8/13,エロマンガ先生,-,B5
マミさんだけ生えていない本,アバランチEX,アバラ丼,2022/12/31,まどかマギカ,ふたなり,B5
かにかまxぷにあなxガン掘りライフ,あらと屋,あらと安里,2021/4/30,オリジナル,ふたなり,B5
こいしお姉ちゃんにまかせなさい,あるたな,雉派(ちぱ),2017/5/7,東方,-,B5
慰め上手のこいしちゃん,あんみつよもぎ亭,みちきんぐ,2017/8/11,東方,-,B5
奥野田が精通上手で酔魔せん,あんみつよもぎ亭,みちきんぐ,2021/12/31,東方,-,B5
大人には,いずみ屋,和泉彪,2018/12/30,FGO,ふたなり,B5
お嬢様も本気出す,えかきびと,えかきびと,2021/12/30,異世界行ったら本気出す,-,B5
ふたなりプランター,エフ屋,メッシィ,2015/5/27,オリジナル,ふたなり,B5
ふたなりフレンド,エフ屋,メッシィ,2016/9/2,オリジナル,ふたなり,B5
ふたなりガールラブ,エフ屋,メッシィ,2016/12/31,オリジナル,ふたなり,B5
ふたなりレイニーディ,エフ屋,メッシィ,2017/5/3,オリジナル,ふたなり,B5
ふたなりエルフちゃん,エフ屋,メッシィ,2017/11/11,オリジナル,ふたなり,B5
ふたなりエルフちゃんサブクエスト,エフ屋,メッシィ,2017/12/31,オリジナル,ふたなり,B5
ふたなりメイドさん朝ミルク,エフ屋,メッシィ,2018/6/29,オリジナル,ふたなり,B5
ふたなり彼女 幼少編,エフ屋,メッシィ,2018/11/23,オリジナル,ふたなり,B5
ふたなり彼女 成長編,エフ屋,メッシィ,2018/12/31,オリジナル,ふたなり,B5
ふたなり彼女のおまけ,エフ屋,メッシィ,2019/3/30,オリジナル,ふたなり,B5
いとこのお姉ちゃんとないしょのミルク,エフ屋,メッシィ,2019/9/6,オリジナル,ふたなり,B5
ないしょのえっちなスケッチ詰め合わせ,エフ屋,メッシィ,2019/12/30,オリジナル,ふたなり,B5
ふたなりエルフ女戦士オナホ化本,エフ屋,メッシィ,2021/11/30,オリジナル,ふたなり,B5
ふたなりおねえちゃんあまあませっくす,エフ屋,メッシィ,2021/12/31,オリジナル,ふたなり,A4
ふたなりシスターのミルクは美味,エフ屋,メッシィ,2022/8/14,オリジナル,ふたなり,B5
ふたなり雪江さんとないしょ尿道姦,エフ屋,メッシィ,2023/5/9,オリジナル,ふたなり,B5
ないしょのふたり,エフ屋,メッシィ,2023/12/31,オリジナル,ふたなり,B5
マリーニップル,エンテレケイア,ちるまくろ,2016/8/14,DoA,-,B5
サーバルニップル,エンテレケイア,ちるまくろ,2017/8/13,けものフレンズ,-,B5
ケッコンずりずり,エンテレケイア,ちるまくろ,2017/12/31,アズールレーン,-,B5
ゆめのなかのリップ,エンテレケイア,ちるまくろ,2018/8/12,FGO,-,B5
ひなこ育成日誌,エンテレケイア,ちるまくろ,2018/12/31,オリジナル,-,B5
ひなこ育成日誌3,エンテレケイア,ちるまくろ,2019/8/11,オリジナル,-,B5
アクア様をいじめる本,エンテレケイア,ちるまくろ,2019/12/31,ボンバーガール,-,B5
パインにわからせる本,エンテレケイア,ちるまくろ,2020/6/23,ボンバーガール,-,B5
ヒモ神さまとひと晩中体液交換,エンテレケイア,ちるまくろ,2023/12/17,ダンまち,-,B5
某芸能事務所盗撮画像流出まとめ3,オオカミうお,オオカミうお,2024/1/3,アイドルマスター,-,B5
タマヒメサマ,おぞね,まるみや,2021/7/31,オリジナル,ふたなり,B5
ふたちゃん キャラブック・プラス,おぞね,まるみや,2021/7/31,オリジナル,ふたなり,B5
ママタマ,おぞね,まるみや,2021/7/31,オリジナル,ふたなり,B5
ふたなりスケッチ3,ガジェット工房,A-10,2016/5/3,ひだまりスケッチ,ふたなり,B5
ふたなりスケッチ4,ガジェット工房,A-10,2017/5/3,ひだまりスケッチ,ふたなり,B5
浦本OMF,カズ屋,由浦カズヤ,2018/8/12,オリジナル,ふたなり,B5
あなたはあなたちゃん,かにどうらく,かにばさみ,2022/8/13,ニジガク,ふたなり,B5
温泉で勃起したハッカドール3号,かにみそ屋,かにかま,2017/8/13,ハッカドール,-,B5
射精を我慢するハッカドール3号,かにみそ屋,かにかま,2017/12/31,ハッカドール,-,B5
あんこといっしょ!,かにみそ屋,かにかま,2018/8/12,まどかマギカ,-,B5
鹿目さんとあんこちゃん,かにみそ屋,かにかま,2018/12/31,まどかマギカ,-,B5
権力者に逆らえず2コマ堕ちする本,かにみそ屋,かにかま,2019/8/12,よろず,-,B5
ち〇こが生えたやすなの本,かにみそ屋,かにかま,2019/12/30,キルミーベイベー,ふたなり,B5
ふたちきゅ,かまた,かまた,2013/5/6,オリジナル,ふたなり,B5
ふたなり秋山殿が冷泉さんでパンツァーハイ!!,カムリズム,鬼頭サケル,2018/8/12,ガールズアンドパンツァー,ふたなり,B5
ふたなり秋山殿が西住さんでパンツァーハイ!!,カムリズム,鬼頭サケル,2018/12/31,ガールズアンドパンツァー,ふたなり,B5
ふたなり冷泉さんが竹部さんでパンツァーハイ!!,カムリズム,鬼頭サケル,2019/8/12,ガールズアンドパンツァー,ふたなり,B5
クソザコま〇こキャルちゃんち〇ぽきしくん,カムリズム,鬼頭サケル,2022/8/14,プリンセスコネクト,-,B5
トキの勃起力改善パーフェクトトレーニング,カムリズム,鬼頭サケル,2023/8/13,ブルーアーカイブ,-,B5
セミナー書記生塩ノアによる逆ちんぽ管理記録,カムリズム,鬼頭サケル,2023/12/31,ブルーアーカイブ,-,B5
ふたなりあくとれず! おへやえっち編,カンチラカンパニー,ぎゅーどん,2023/8/12,アリスギア,ふたなり,B5
ショウトツカイキン?,くまのとおるみち,くまだ,2016/8/13,艦これ,もがみん,B5
ミカと初めての共同作業,ぐりいん野はうす,温野りょく,2022/12/30,ブルーアーカイブ,-,B5
ミカとHする本,ぐりいん野はうす,温野りょく,2023/8/12,ブルーアーカイブ,-,B5
ふたなり48手指南線画集,ぐるぐる本舗,池田和宏,2021/6/6,オリジナル,ふたなり,B5
大晦日だョ!怒りの干支レース,ぐるぐる本舗,池田和宏,2021/12/31,オリジナル,ふたなり,B5
コハルとスケベする本,くれり亭,くれりて,2023/8/12,ブルーアーカイブ,-,B5
レンゲとこづくりセックスする本,くれり亭,くれりて,2023/12/30,ブルーアーカイブ,-,B5
春のつづき,ゲルピン,水無月十三,2018/8/12,プリキュア,ふたなり,B5
鳥海さんも及ばれしたい!,けんろー工房,おりもとみまな,2016/12/31,艦これ,-,B5
あなたの●●何センチ?,こくまろ調整豆乳,オーマンズリーダス,2022/8/14,オリジナル,-,A4
SF-MECHANIC Part2,コミック・ナット,岩気祐司,1985/8/11,オリジナル,-,B5
コミックガムNekoMimi Mode2004,コミックガム,コミックガム,2004/12/1,月詠 -MOON PHASE-,,B5
魔法英雄物語,コミックぴか,恋緒みなと,1990/8/19,オリジナル,-,B5
山郷ハラスメント,ザ・バナナピストルズ,山吉ファン太,2018/8/11,ガールズアンドパンツァー,-,B5
山郷エンゲージ,ザ・バナナピストルズ,山吉ファン太,2019/12/28,ガールズアンドパンツァー,-,B5
Project Sicorpio,サークルQUDA,Qudamono,2017/4/30,オリジナル,ふたなり,B5
生えも2,サークルとこやま,とこやまけいた,2019/12/28,プリチャン,-,B5
秘書艦最上くんの場合,サシミノイワ,しでん,2017/12/31,艦これ,もがみん,B5
Once and again!!,サヨナラホーネット,ヨシラギ,2017/12/29,FGO,ふたなり,B5
OJY1DVI2,サヨナラホーネット,ヨシラギ,2018/12/31,FGO,-,B5
徐福ちゃんなんかで卒業したくないやい!,サルパッチョ,わいら,2023/8/13,FGO,-,B5
メリュ子はぐいぐい来るが交尾がド下手。,サルパッチョ,わいら,2023/12/31,FGO,-,B5
ふたなり化及び性欲増強アーツ 経過観察記録 術師編,さんどるまん,みりちく,2023/3/12,アークナイツ,ふたなり,A5
提督はどーしても能代とHがしたい!!,じぇのばけーき,たかやKi,2016/8/14,艦これ,-,B5
うきうきCRISIS,ししゃもハウス,西野靖博,1986/12/28,オリジナル,-,B5
ガルパン授乳部。,ジャックとニコルソン,のりパチ,2017/12/31,ガールズアンドパンツァー,-,B5
RETAKE4,スタジオKIMIGABUCHI,スタジオKIMIGABUCHI,2006/8/11,エヴァンゲリオン,-,B5
RETAKE After,スタジオKIMIGABUCHI,スタジオKIMIGABUCHI,2006/12/29,エヴァンゲリオン,-,B5
Paろでぃっく3,スタジオSFC,スタジオSFC,1986/8/10,アニパロ,-,B5
ツチノコのチンチン天国射精地獄,すみからすみまで,ガビョ布,2022/12/31,けものフレンズ,ふたなり,B5
従順用姦最上,セニマンカルタン,虎助遥人,2015/12/31,艦これ,もがみん,B5
明石バイブレーション2,セニマンカルタン,虎助遥人,2016/12/31,艦これ,-,B5
サンタ鈴谷とえっちしよっ,セニマンカルタン,虎助遥人,2017/2/26,艦これ,-,B5
すずもがsensetion,セニマンカルタン,虎助遥人,2017/8/13,艦これ,もがみん,B5
ふたなり露出JKですが?4,そらむね,柚子ラムネ,2017/11/11,オリジナル,ふたなり,B5
ふたなり露出JKですが?5,そらむね,柚子ラムネ,2017/12/31,オリジナル,ふたなり,B5
お金が無くなったアルちゃんは気づいたら屈強な男たちに囲まれていた件。,ぞんびと愉快な仲間たち,すーぱーぞんび,2021/12/30,ブルーアーカイブ,-,B5
ふたなり社会人射精入院編,たいぼく,たいぼく,2023/5/5,オリジナル,ふたなり,変形
黒潮ちゃれんじ,たけ家,竹虎スズメ,2019/12/29,艦これ,-,B5
黒潮さん,たけ家,竹虎スズメ,2022/12/30,艦これ,-,B5
POSTGIRLさんはふりむかない。,チョットだけアルヨ。,竹村雪秀,2005/12/30,オリジナル,ふたなり,B5
あけくらし,チョットだけアルヨ。,竹村雪秀,2018/8/12,艦これ,ふたなり,B5
としのくれ,チョットだけアルヨ。,竹村雪秀,2018/12/31,艦これ,ふたなり,B5
うちしきり,チョットだけアルヨ。,竹村雪秀,2019/8/12,艦これ,ふたなり,B5
おくゆかし大湊編,チョットだけアルヨ。,竹村雪秀,2021/12/30,艦これ,ふたなり,B5
かけかけし,チョットだけアルヨ。,竹村雪秀,2022/12/31,艦これ,ふたなり,B5
おくゆかし2佐世保・大湊編,チョットだけアルヨ。,竹村雪秀,2023/12/31,艦これ,ふたなり,B5
めどぅえっち2さつめ,ドットエイト,さわやか鮫肌,2019/12/31,グランブルーファンタジー,ふたなり,B5
加賀さんに生えたので島風が一肌ぬぎました。,とまほーく,あっくす,2019/9/22,艦これ,ふたなり,B5
おなぼん。,とまほーく,あっくす,2020/2/9,オリジナル,-,B5
おなぼん。2,とまほーく,あっくす,2020/11/23,オリジナル,-,B5
おなぼん。3,とまほーく,あっくす,2022/9/1,オリジナル,-,B5
バックステージ IDOLxTWO-FACED,とらのあな,とらのあな,2021/5/1,オリジナル,イラスト,B5
超運動会超アカリハウス,なかよひモグダン,モグダン,1999/12/26,大運動会,-,B5
Natsukisugi,偽MIDI泥の会,石恵,2016/8/14,Reゼロから始める異世界生活,-,A4
杏山カズサのトリセツ,にんげんっていいな,にんげん,2023/12/30,ブルーアーカイブ,-,B5
ふたなりってナニ?,ねこあらし,也な,2022/8/14,オリジナル,ふたなり,B5
ふたなりアイドルでかたま露出ゲーム(仮),ハースニール,みさくらなんこつ,2012/12/31,オリジナル,ふたなり,B5
ふたなり芽衣ちゃんのヌきまくり夏休み,ハースニール,みさくらなんこつ,2018/8/12,オリジナル,ふたなり,B5
この因縁の二人で終止符を!,ハイテクペンケース,Tam-U,2016/12/31,この素晴らしい世界に祝福を,-,B5
駄メイドと密談を!,ハイテクペンケース,Tam-U,2017/4/18,この素晴らしい世界に祝福を,-,B5
大人のジャパリまん〇!,ハイパーピンチ,clover,2017/4/30,けものフレンズ,-,B5
お栄さんとふたなりアビーの閻魔亭生ハメ中出し交尾日誌,ばな奈工房,青ばなな,2019/8/12,FGO,ふたなり,B5
ナニよそれ?バッカじゃないの!,はにゃ屋敷,はにゃ,2022/8/14,よろず,ふたなり,B5
CHOICE2,はぽい処,岡崎武士,2016/12/31,Reゼロから始める異世界生活,-,B5
種付デビュー!?,ビーメロクリシェ,サインこす,2021/12/30,おちこぼれフルーツタルト,-,B5
ちょこっと。,ビーメロクリシェ,サインこす,2022/5/8,アイドルマスター,-,B5
センバツ!おなほ娘,ビーメロクリシェ,サインこす,2022/8/14,アイドルマスター,-,B5
おじさま専用2023,ビーメロクリシェ,サインこす,2023/12/31,よろず,-,B5
フタミルクあつめ,ピエピロー,あぴゃるぴえ,2018/6/9,オリジナル,ふたなり,B5
生えてる!駆け出し冒険者トリオ,ピエピロー,あぴゃるぴえ,2018/11/23,オリジナル,ふたなり,B5
ふた堕ちるし!,ピエピロー,あぴゃるぴえ,2019/3/30,オリジナル,ふたなり,B5
三人のふたなり冒険者と謎のクエストBOX,ピエピロー,あぴゃるぴえ,2019/9/23,オリジナル,ふたなり,B5
レムのエミリアくっつけ大作戦,ピコロボ,Piro,2016/12/31,Reゼロから始める異世界生活,-,B5
ガルパンキャラにエッチなお願いをしてみる本,ヒビメガネ,ヒビメガネ,2017/5/7,ガールズアンドパンツァー,-,B5
ふれあい愛里寿ちゃんランド,ヒビメガネ,ヒビメガネ,2017/8/12,ガールズアンドパンツァー,-,B5
お俺の妹がぁ4,ひょこ道,ひょころー,2011/8/14,俺の妹がこんなに可愛いわけがない,-,B5
ぼっき・ざ・ろっく!,ふたゆりアンソロリ,すずきひとなり,2023/8/13,ぼっち・ざ・ろっく!,ふたなり,B5
おっぱい学習帳,ぶらっくびねがー,サルシッチャ牧野,2023/12/31,オリジナル,-,B5
ポプニ系女子パニックVol.10,ぽてとさらだ,ヒめくり,2021/12/31,オリジナル,-,B5
Love:レムから始める早漏改善生活,ぽぽちち,ハ尋ぽち,2016/8/14,Reゼロから始める異世界生活,-,B5
Re:レムちゃん落書き本,まかろん大帝,がおん,2017/8/12,Reゼロから始める異世界生活,イラスト,B5
marine,まろん工房,サガノユウジ,2019/12/30,オリジナル,-,A4
marine 2nd,まろん工房,サガノユウジ,2021/12/31,オリジナル,-,A4
司令官、3Pするわよ!,みそはんせん,ラリアット,2019/12/29,艦これ,ふたなり,B5
しましまストライプ!!,みそはんせん,ラリアット,2020/5/3,艦これ,ふたなり,B5
futanari illustration01,むゐ画廊,むゐ,2018/6/9,オリジナル,ふたなり,B5
ふたなり娘研究チャンネル,むゐ画廊,むゐ,2019/9/23,オリジナル,ふたなり,B5
楽しい通学ドキドキオ〇ニー,むゐ画廊,むゐ,2019/9/23,オリジナル,ふたなり,B5
futanari illustration03,むゐ画廊,むゐ,2020/3/21,オリジナル,ふたなり,B5
ふたなり姉妹がなかよくHする本,むゐ画廊,むゐ,2023/5/4,オリジナル,ふたなり,B5
ダヴィンチンコード,メスマン帝国,交介,2018/8/12,FGO,ふたなり,B5
山城とレパルスの本,メメ屋,メメ50,2017/12/31,アズールレーン,-,B5
ウマほん,メルヘンBOX,MAOの,2018/8/11,ウマ娘,ふたなり,B5
おにまい裏ファンブック2,メルヘンBOX,MAOの,2023/12/30,おにまい,-,B5
襲 SIMPLEフェチシリーズ34,メルヘンBOX,MAOの,2023/12/30,オリジナル,-,B5
