タイトル,五十音,サークル名,発行者,発行年,ジャンル作品,ジャンル癖,サイズ
雪ちんぽ ほろ酔いあずささんがふたなり雪歩とえっちする本,す,水密桃工房,モモの水道水,2019/8/11,アイドルマスター,ふたなり,B5
ある日突然ふたなりになったらPhase1,す,水密桃工房,モモの水道水,2019/11/24,オリジナル,ふたなり,B5
雪ちんぽ ふたなり雪歩が暴走して伊織とえっちしちゃう本,す,水密桃工房,モモの水道水,2019/12/30,アイドルマスター,ふたなり,B5
アイドルふたなり化スイッチ,す,水密桃工房,モモの水道水,2020/7/28,アイドルマスター,ふたなり,B5
雪ちんぽ ふたなり雪歩のにおいで<br>やよいがトリップしちゃう本,す,水密桃工房,モモの水道水,2022/12/31,アイドルマスター,ふたなり,B5
双成寺女学園学内レポート,す,水密桃工房,モモの水道水,2023/5/4,オリジナル,ふたなり,B5
搾雪 ふたなり雪歩が搾られる本,す,水密桃工房,モモの水道水,2023/8/13,アイドルマスター,ふたなり,B5
双成寺女学園 交戦,す,水密桃工房,モモの水道水,2023/12/31,オリジナル,ふたなり,B5
従順用姦最上,せ,セニマンカルタン,虎助遥人,2015/12/31,艦これ,もがみん,B5
明石バイブレーション2,せ,セニマンカルタン,虎助遥人,2016/12/31,艦これ,-,B5
サンタ鈴谷とえっちしよっ,せ,セニマンカルタン,虎助遥人,2017/2/26,艦これ,-,B5
すずもがsensetion,せ,セニマンカルタン,虎助遥人,2017/8/13,艦これ,もがみん,B5
駆逐艦船体検査提督所見報告書,せ,青春カツサンド,かっさんどら,2015/12/30,艦これ,-,B5
巡洋艦船体検査提督所見報告書,せ,青春カツサンド,かっさんどら,2016/12/29,艦これ,-,B5
戦艦空母船体検査提督所見報告書,せ,青春カツサンド,かっさんどら,2017/12/29,艦これ,-,B5
ASLO1PLUS,せ,千夜茶房,α・アルフライラ,2007/2/22,オリジナル,ふたなり,B5
ふたなりっ!4準備号,せ,全日本生えてる會,ケミガワ,2017/5/3,オリジナル,ふたなり,B5
ふたなり露出JKですが?4,そ,そらむね,柚子ラムネ,2017/11/11,オリジナル,ふたなり,B5
ふたなり露出JKですが?5,そ,そらむね,柚子ラムネ,2017/12/31,オリジナル,ふたなり,B5
お金が無くなったアルちゃんは<br>気づいたら屈強な男たちに囲まれていた件。,そ,ぞんびと愉快な仲間たち,すーぱーぞんび,2021/12/30,ブルーアーカイブ,-,B5
SHOOTING STAR Vol.1,そ,創作同人流星群,梶慧,1986/6/14,オリジナル,-,B5
TYPE-64a,た,TYPE-54,Frunbell,2021/11/29,ニジガク,-,B5
TYPE-67a,た,TYPE-54,Frunbell,2022/10/23,彼女、人見知ります,-,B5
TYPE-68a,た,TYPE-54,Frunbell,2022/12/30,リコリスリコイル,-,B5
TYPE-71,た,TYPE-54,Frunbell,2024/5/19,負けヒロイン,-,B5
ふたなり社会人射精入院編,た,たいぼく,たいぼく,2023/5/5,オリジナル,ふたなり,変形
黒潮ちゃれんじ,た,たけ家,竹虎スズメ,2019/12/29,艦これ,-,B5
黒潮さん,た,たけ家,竹虎スズメ,2022/12/30,艦これ,-,B5
うちの子たちは可愛い!!,た,堕落園,みどりの,2023/12/31,オリジナル,-,B5
MIDORI NOTE,た,堕落園,みどりの,2024/8/12,オリジナル,-,B5
Record&Recording,た,台北人,虫原,2022/9/25,リコリスリコイル,ふたなり,A5
Surprise&Seduce,た,台北人,虫原,2022/12/31,リコリスリコイル,ふたなり,A5
万引きJK生けいおん部,た,蛸壷屋,蛸壷屋,2009/8/16,けいおん,-,B5
落とし穴からの脱出,た,田中家の鴨,たなかあひる,2023/12/30,葬送のフリーレン,-,B5
Lovely Submarin,ち,CHIBIKKO KINGDOM,けこちゃ,2015/8/16,艦これ,潜水艦,B5
駄メイドは坊っちゃまのオナペット,ち,チュラクナ,ドロンタビ,2022/12/31,オリジナル,-,B5
POSTGIRLさんはふりむかない。,ち,チョットだけアルヨ。,竹村雪秀,2005/12/30,オリジナル,ふたなり,B5
あけくらし,ち,チョットだけアルヨ。,竹村雪秀,2018/8/12,艦これ,ふたなり,B5
としのくれ,ち,チョットだけアルヨ。,竹村雪秀,2018/12/31,艦これ,ふたなり,B5
うちしきり,ち,チョットだけアルヨ。,竹村雪秀,2019/8/12,艦これ,ふたなり,B5
おくゆかし大湊編,ち,チョットだけアルヨ。,竹村雪秀,2021/12/30,艦これ,ふたなり,B5
かけかけし,ち,チョットだけアルヨ。,竹村雪秀,2022/12/31,艦これ,ふたなり,B5
おくゆかし2佐世保・大湊編,ち,チョットだけアルヨ。,竹村雪秀,2023/12/31,艦これ,ふたなり,B5
暑い日ゆらゆら,ち,チョットだけアルヨ。,竹村雪秀,2024/8/12,艦これ,-,B5
これ本当にマッサージなんですか!?,ち,中部漫団,重荷路無線,2022/12/31,オリジナル,-,B5
おん・ざ・ろっく!,ち,中部漫団,重荷路無線,2023/8/13,ぼっち・ざ・ろっく!,-,B5
女の子たちのひみつの冒険,ち,超斬開,TERてあ,2020/12/29,ポケモン,-,B5
女の子たちのひみつの冒険2,ち,超斬開,TERてあ,2021/5/29,ポケモン,-,B5
女の子たちのひみつの冒険3,ち,超斬開,TERてあ,2022/2/12,ポケモン,-,B5
女の子たちのいにしえの冒険,ち,超斬開,TERてあ,2022/9/11,ポケモン,-,B5
オナホ売りの少女,ち,超斬開,TERてあ,2023/12/31,オリジナル,-,B5
21号改造計画,ち,超時空要塞カチューシャ,電気将軍,2018/8/12,ドラゴンボール,ふたなり,B5
頬の薄紅褪せぬ間に,つ,TUKIBUTO,氷樹一世,2014/8/17,艦これ,蒼龍,B5
ふたなりシスター はじめての説教,つ,筒森園,筒森,2021/12/31,オリジナル,ふたなり,B5
瓜報・2,て,T2 UNIT,Franken N,1990/12/24,アニパロ,-,B5
艦む寿司,て,Teaset's,茶器,2017/12/29,艦これ,-,変形
最上とイチャイチャ喧嘩ックス!!,て,適齢期に食中毒,沢村青,2023/12/30,艦これ,最上,B5
めどぅえっち2さつめ,と,ドットエイト,さわやか鮫肌,2019/12/31,グランブルーファンタジー,ふたなり,B5
加賀さんに生えたので島風が一肌ぬぎました。,と,とまほーく,あっくす,2019/9/22,艦これ,ふたなり,B5
おなぼん。,と,とまほーく,あっくす,2020/2/9,オリジナル,-,B5
おなぼん。2,と,とまほーく,あっくす,2020/11/23,オリジナル,-,B5
おなぼん。3,と,とまほーく,あっくす,2022/9/1,オリジナル,-,B5
バックステージ IDOLxTWO-FACED,と,とらのあな,とらのあな,2021/5/1,オリジナル,イラスト,B5
魔法騎士の白いアレ,な,70年式悠久機関,おはぎさん,2013/4/28,レイアース,ふたなり,B5
乙女騎士の淫靡ていしょん,な,70年式悠久機関,おはぎさん,2021/8/28,オリジナル,ふたなり,B5
Hな女子高生つめ,な,７番の置物,藤鼠,2016/12/31,オリジナル,-,A5
Hな女子高生つめ2,な,７番の置物,藤鼠,2017/12/31,オリジナル,-,A5
異世界娼館,な,Naitou2,F4U,2016/8/14,オリジナル,-,B5
搾精ダンジョン攻略に向かない地味子のS級ドスケベステータス,な,Naitou2,F4U,2021/5/4,オリジナル,-,B5
恋愛禁止の勇者パーティーに向かない地味子のS級ドスケベステータス,な,Naitou2,F4U,2022/8/14,オリジナル,-,B5
超運動会超アカリハウス,な,なかよひモグダン,モグダン,1999/12/26,大運動会,-,B5
ななおのナイショ,な,夜FUCKERS,ミツギ,2018/12/31,オリジナル,ふたなり,B5
杏山カズサのトリセツ,に,にんげんっていいな,にんげん,2023/12/30,ブルーアーカイブ,-,B5
Natsukisugi,に,偽MIDI泥の会,石恵,2016/8/14,Reゼロから始める異世界生活,-,A4
発情期だから仕方なかった,ぬ,ぬめりけ,おち,2024/8/11,ブルーアーカイブ,-,B5
ふたなりってナニ?,ね,ねこあらし,也な,2022/8/14,オリジナル,ふたなり,B5
古書館ウィシュリスト,は,Ballistic onahole,Б,2022/12/31,ブルーアーカイブ,-,B5
ふたなりアイドルでかたま露出ゲーム(仮),は,ハースニール,みさくらなんこつ,2012/12/31,オリジナル,ふたなり,B5
ふたなり芽衣ちゃんのヌきまくり夏休み,は,ハースニール,みさくらなんこつ,2018/8/12,オリジナル,ふたなり,B5
この因縁の二人で終止符を!,は,ハイテクペンケース,Tam-U,2016/12/31,この素晴らしい世界に祝福を,-,B5
駄メイドと密談を!,は,ハイテクペンケース,Tam-U,2017/4/18,この素晴らしい世界に祝福を,-,B5
大人のジャパリまん〇!,は,ハイパーピンチ,clover,2017/4/30,けものフレンズ,-,B5
お栄さんとふたなりアビーの閻魔亭生ハメ中出し交尾日誌,は,ばな奈工房,青ばなな,2019/8/12,FGO,ふたなり,B5
ナニよそれ?バッカじゃないの!,は,はにゃ屋敷,はにゃ,2022/8/14,よろず,ふたなり,B5
CHOICE2,は,はぽい処,岡崎武士,2016/12/31,Reゼロから始める異世界生活,-,B5
アリスと一緒にRPGごっこしましょう,は,半里プラザ,半里バード,2022/8/16,ブルーアーカイブ,-,B5
私はホシノがいいんだよ!!,は,半里プラザ,半里バード,2022/12/21,ブルーアーカイブ,-,B5
メス狐は視てしまった。,は,半里プラザ,半里バード,2023/12/31,ブルーアーカイブ,-,B5
先生が望むなら。,は,半里プラザ,半里バード,2024/8/10,ブルーアーカイブ,-,B5
すわショタ01,ひ,100円外務省,みりの,2017/8/11,東方,-,B5
すわショタ番外編10 すわ姉ちゃんが近いっ!!,ひ,100円外務省,みりの,2017/10/15,東方,-,B5
MEDICAK DRUNKARD,ひ,pinvise,涼月くらら,2013/8/11,宇宙戦艦ヤマト,-,B5
Real Intention,ひ,pinvise,涼月くらら,2015/8/16,甘城ブリリアントパーク,-,B5
Sparkling Vacation Homework,ひ,pinvise,涼月くらら,2022/10/17,オリジナル,-,B5
鬼方カヨコはこんなことしない。,ひ,PTPYworks,シャモナベ,2022/8/14,ブルーアーカイブ,-,B5
惑溺する風信子(ヒヤシンス),ひ,PTPYworks,シャモナベ,2022/12/30,ブルーアーカイブ,-,B5
先生は弱いのでアリスが守護ります!,ひ,PTPYworks,シャモナベ,2023/8/12,ブルーアーカイブ,-,B5
鬼方カヨコはこんなことしない。2,ひ,PTPYworks,シャモナベ,2023/12/30,ブルーアーカイブ,-,B5
CS:GOD,ひ,PTPYworks,シャモナベ,2024/8/12,ブルーアーカイブ,-,B5
チャージングP15,ひ,P商会,P商会,1993/12/30,オリジナル,ふたなり,B5
種付デビュー!?,ひ,ビーメロクリシェ,サインこす,2021/12/30,おちこぼれフルーツタルト,-,B5
ちょこっと。,ひ,ビーメロクリシェ,サインこす,2022/5/8,アイドルマスター,-,B5
センバツ!おなほ娘,ひ,ビーメロクリシェ,サインこす,2022/8/14,アイドルマスター,-,B5
おじさま専用2023,ひ,ビーメロクリシェ,サインこす,2023/12/31,よろず,-,B5
フタミルクあつめ,ひ,ピエピロー,あぴゃるぴえ,2018/6/9,オリジナル,ふたなり,B5
生えてる!駆け出し冒険者トリオ,ひ,ピエピロー,あぴゃるぴえ,2018/11/23,オリジナル,ふたなり,B5
ふた堕ちるし!,ひ,ピエピロー,あぴゃるぴえ,2019/3/30,オリジナル,ふたなり,B5
三人のふたなり冒険者と謎のクエストBOX,ひ,ピエピロー,あぴゃるぴえ,2019/9/23,オリジナル,ふたなり,B5
レムのエミリアくっつけ大作戦,ひ,ピコロボ,Piro,2016/12/31,Reゼロから始める異世界生活,-,B5
ガルパンキャラにエッチなお願いをしてみる本,ひ,ヒビメガネ,ヒビメガネ,2017/5/7,ガールズアンドパンツァー,-,B5
ふれあい愛里寿ちゃんランド,ひ,ヒビメガネ,ヒビメガネ,2017/8/12,ガールズアンドパンツァー,-,B5
お俺の妹がぁ4,ひ,ひょこ道,ひょころー,2011/8/14,俺の妹がこんなに可愛いわけがない,-,B5
好きだ,ひ,東村山研究棟,村山東一,2019/12/28,ケムリクサ,-,B5
セーラー服MAGAZINE くせになりそぉVol.3,ひ,秘密結社M,椎名望亜,1988/5/3,オリジナル,-,B5
せふいい,ひ,秒殺狸団,佐伯達也,2016/5/1,魔法少女なんてもういいですから。,-,B5
ま、いっか!,ふ,BlueMage,あおいまなぶ,2019/10/20,アリスギア,-,B5
惨状合体ひぐらしGO!,ふ,BlueMage,あおいまなぶ,2020/12/20,ひぐらしのなく頃に,-,B5
ウィッ乳,ふ,BlueMage,あおいまなぶ,2020/12/27,ストライクウィッチーズ,-,B5
豊穣沙都子ルチーアに咲く,ふ,BlueMage,あおいまなぶ,2021/5/23,ひぐらしのなく頃に,-,B5
ほなにー 秋山殿潜入大作戦(失敗),ふ,bolze.,○蜜柑,2013/2/17,ガールズアンドパンツァー,-,B5
Izetta mit Schwanz,ふ,bolze.,○蜜柑,2017/8/11,終末のイゼッタ,-,B5
ふたりで接待、若おかみ! おっこ・真月編,ふ,bolze.,○蜜柑,2018/12/29,若おかみは小学生,-,B5
総決算と算術使い,ふ,ぷ玉工房,ぷ玉,2024/8/12,ブルーアーカイブ,-,B5
ぼっき・ざ・ろっく!,ふ,ふたゆりアンソロリ,すずきひとなり,2023/8/13,ぼっち・ざ・ろっく!,ふたなり,B5
おっぱい学習帳,ふ,ぶらっくびねがー,サルシッチャ牧野,2023/12/31,オリジナル,-,B5
おねえちゃんとっギュステでサマバケしたい!,ふ,藤屋本店,藤ます,2018/8/12,グランブルーファンタジー,-,B5
カルデアマニア・鬼&魔,へ,Bear Hand,俺正読,2019/4/14,FGO,ふたなり,B5
カルデアマニア・黒&白(ジャンヌ),へ,Bear Hand,俺正読,2019/4/14,FGO,ふたなり,B5
カルデアマニア・トリオブラウン,へ,Bear Hand,俺正読,2019/8/12,FGO,ふたなり,B5
カルデアマニア・源頼光,へ,Bear Hand,俺正読,2019/8/12,FGO,ふたなり,B5
FIRE!CRACKER6,へ,HEAVEN'S UNIT,光野けい,1999/5/16,逮捕しちゃうぞ,-,B5
風の香も,へ,Peθ,もず,2013/12/31,艦これ,もがみん,B5
Halu…,へ,Peθ,もず,2016/12/31,ストライクウィッチーズ,ニパ,B5
ポプニ系女子パニックVol.10,ほ,ぽてとさらだ,ヒめくり,2021/12/31,オリジナル,-,B5
Love:レムから始める早漏改善生活,ほ,ぽぽちち,ハ尋ぽち,2016/8/14,Reゼロから始める異世界生活,-,B5
さよなら迅鯨 忌雷編,ま,M.A.D. WORKS,たむ,2022/8/14,艦これ,-,A5
さよなら迅鯨 発情編,ま,M.A.D. WORKS,たむ,2022/12/30,艦これ,-,A5
さよなら迅鯨 エステ編,ま,M.A.D. WORKS,たむ,2023/8/12,艦これ,-,A5
Re:レムちゃん落書き本,ま,まかろん大帝,がおん,2017/8/12,Reゼロから始める異世界生活,イラスト,B5
marine,ま,まろん工房,サガノユウジ,2019/12/30,オリジナル,-,A4
marine 2nd,ま,まろん工房,サガノユウジ,2021/12/31,オリジナル,-,A4
レムのエッチな悩みを解決してくださいっ,ま,魔太郎,魔太郎,2016/8/14,Reゼロから始める異世界生活,-,B5
イリヤちゃんを完全同意(さいみん)でママにする本,ま,毎日健康生活,ヘルシーマン,2022/12/31,FGO,-,B5
この星の下で,み,mirumiru,もみる,2023/3/18,ぼっち・ざ・ろっく!,ふたなり,A5
司令官、3Pするわよ!,み,みそはんせん,ラリアット,2019/12/29,艦これ,ふたなり,B5
しましまストライプ!!,み,みそはんせん,ラリアット,2020/5/3,艦これ,ふたなり,B5
futanari illustration01,む,むゐ画廊,むゐ,2018/6/9,オリジナル,ふたなり,B5
ふたなり娘研究チャンネル,む,むゐ画廊,むゐ,2019/9/23,オリジナル,ふたなり,B5
楽しい通学ドキドキオ〇ニー,む,むゐ画廊,むゐ,2019/9/23,オリジナル,ふたなり,B5
futanari illustration03,む,むゐ画廊,むゐ,2020/3/21,オリジナル,ふたなり,B5
ふたなり姉妹がなかよくHする本,む,むゐ画廊,むゐ,2023/5/4,オリジナル,ふたなり,B5
それなに…!?,む,村井村,村井村,2022/8/14,スローループ,ふたなり,B5
ダヴィンチンコード,め,メスマン帝国,交介,2018/8/12,FGO,ふたなり,B5
山城とレパルスの本,め,メメ屋,メメ50,2017/12/31,アズールレーン,-,B5
ウマほん,め,メルヘンBOX,MAOの,2018/8/11,ウマ娘,ふたなり,B5
おにまい裏ファンブック2,め,メルヘンBOX,MAOの,2023/12/30,おにまい,-,B5
襲 SIMPLEフェチシリーズ34,め,メルヘンBOX,MAOの,2023/12/30,オリジナル,-,B5
おにまい裏ファンブック3,め,メルヘンBOX,MAOの,2024/8/11,おにまい,-,B5
ツルギだって青春したい,め,目つき悪い教団,駿河クロイツ,2023/12/31,ブルーアーカイブ,-,B5
レムちゃんは発情期,も,moriQ,森あいり,2016/9/24,Reゼロから始める異世界生活,-,B5
精処理覚えたてふたなりちんちんで<br>無双しているせるふを絶対に止めて見せる,も,もちもちブルドーザー部,しゅぽーん,2023/8/6,DIY,ふたなり,B5
up! VOL.1,も,モルテンクラブ,あらいずみるい,1985/8/11,オリジナル,-,B5
常夏艦隊,も,木綿シリコン,川科,2014/8/15,艦これ,もがみん,B5
承認欲求,や,焼きトリ定食,トリヤロウ,2022/12/31,ぼっち・ざ・ろっく!,ふたなり,B5
欲求不満,や,焼きトリ定食,トリヤロウ,2023/3/18,ぼっち・ざ・ろっく!,ふたなり,B5
催淫絶頂,や,焼きトリ定食,トリヤロウ,2023/8/13,ぼっち・ざ・ろっく!,ふたなり,B5
フタユウカアーカイブ,や,焼きトリ定食,トリヤロウ,2024/1/20,ブルーアーカイブ,ふたなり,B5
フタユウカアーカイブ弐,や,焼きトリ定食,トリヤロウ,2024/8/12,ブルーアーカイブ,ふたなり,B5
ヲタ子さんVSスノーボウ,よ,横島ん家,Ash横島,2019/8/11,オリジナル,ふたなり,B5
ふたなり霊夢はお金が欲しい!!,よ,余はおかずを所望しておる,しや,2017/10/15,東方,ふたなり,B5
性欲処理長ふたなり咲夜,よ,余はおかずを所望しておる,しや,2017/12/29,東方,ふたなり,B5
早苗と文のヘンタイふたなり密会,よ,余はおかずを所望しておる,しや,2018/8/10,東方,ふたなり,B5
がんばれ椛!文ちゃんのちんぽに負けるな!,よ,余はおかずを所望しておる,しや,2019/5/5,東方,ふたなり,B5
射精させてください咲夜さん!!,よ,余はおかずを所望しておる,しや,2019/8/12,東方,ふたなり,B5
モラ活,ら,Lovewn Outpost,BLADE,2021/12/30,原神,-,B5
RAPE THE PLATONIC Part3,ら,ラインの守り商会,曲芸的自慰者,1986/8/10,アニパロ,-,B5
異世界転生したらふたなり勇者様だった件,ら,来世はふたなり美少女,orion,2022/11/3,オリジナル,ふたなり,B5
魔法力強化計画ブレイブブレイク,ら,雷神会,はるきゲにあ,2016/11/20,ストライクウィッチーズ,-,B5
魔法少女催眠パコパコーズ,ら,乱視と君と。,santa,2017/8/13,FGO,-,B5
カズサに生えた。(生やした),り,りゅうせゐ園,やらゐ,2023/12/30,ブルーアーカイブ,ふたなり,B5
ビュルーアーイクイクVol.1快楽陰茎編,り,りゅうせゐ園,syoya,2023/12/30,オリジナル,ふたなり,A5
もこもこXXディフュージョン,り,流体ユリナアル,流体肉,2021/5/29,プリキュア,-,B5
ふたなり特濃ミルクサーバー5,る,ルート十二面体,ランドルトたまき,2017/2/12,オリジナル,ふたなり,B5
ふたなり特濃ミルクサーバー7,る,ルート十二面体,ランドルトたまき,2017/11/11,オリジナル,ふたなり,B5
ふたなり特濃ミルクサーバー8,る,ルート十二面体,ランドルトたまき,2018/11/23,オリジナル,ふたなり,B5
MAO.,れ,RED DRAGON,HASHIBA.H,2002/8/9,-,-,B5
責任感もほどほどにしてくださいね!,れ,恋愛漫画家,恋愛漫画家,2023/12/30,ガンダム,水星,B5
ヒトのオナニーを笑うな,ろ,ろーぷあいらんど,みやのゆき,2024/8/11,プリキュア,-,B5
たまつきふたがヤラれるほん3,ろ,ろぜったすとーん,ててるん,2018/11/23,オリジナル,ふたなり,B5
ろくろの回し者のラクガキ帳,ろ,ロリコンクリニック,ろくろの回し者,2023/8/8,オリジナル,-,B5
ろくろの回し者のラクガキ帳その2,ろ,ロリコンクリニック,ろくろの回し者,2023/12/31,オリジナル,-,B5
ろくろの回し者のラクガキ帳その3,ろ,ロリコンクリニック,ろくろの回し者,2024/8/12,オリジナル,-,B5
WASANBON VOL.8,わ,わさんぼん,wa,2017/8/13,艦これ,-,B5
尻型重巡と一緒にお風呂,わ,ワトサト,杉浦線,2014/12/29,艦これ,もがみん,B5
銃と母乳と吸血鬼2,わ,惑星ノスタルジー,常磐緑,2023/8/13,オリジナル,ふたなり,B5
ブルアカふたなり合同,ん,合同,伊巻てん,2023/8/12,ブルーアーカイブ,ふたなり,B5
