タイトル,五十音,サークル名,発行者,発行年,ジャンル作品,ジャンル癖,サイズ
ろり＆ふた8 伊58&呂500,あ,Achoromic,夢双月,2017/5/1,艦これ,ふたなり,B5
ろり＆ふた10 暁&響,あ,Achoromic,夢双月,2018/1/1,艦これ,ふたなり,B5
ろり＆ふた11,あ,Achoromic,夢双月,2018/8/13,プリズマイリヤ,ふたなり,B5
ろり＆ふた13,あ,Achoromic,夢双月,2020/8/2,アイドルマスター,ふたなり,B5
ろり＆ふた12,あ,Achoromic,夢双月,"	2019/01/01",小林さんちのメイドラゴン,ふたなり,B5
教師ひとり、生徒ひとり。,あ,Asunaro Neat.,ろんな,2021/12/31,オリジナル,-,B5
TSロリおじさんの冒険 オナニー編,あ,Asunaro Neat.,ろんな,2022/12/31,オリジナル,-,B5
TSロリおじさんの冒険閑話 ふわふわドーム編,あ,Asunaro Neat.,ろんな,2023/8/13,オリジナル,-,B5
TSロリおじさんの冒険閑話 ハンドメイドの章,あ,Asunaro Neat.,ろんな,2023/12/31,オリジナル,-,B5
TSロリおじさんの冒険 セックス編準備号,あ,Asunaro Neat.,ろんな,2024/8/12,オリジナル,-,B5
TSロリおじさんの冒険閑話集,あ,Asunaro Neat.,ろんな,2024/8/12,オリジナル,-,B5
マミさんだけ生えていない本,あ,アバランチEX,アバラ丼,2022/12/31,まどかマギカ,ふたなり,B5
かにかまxぷにあなxガン掘りライフ,あ,あらと屋,あらと安里,2021/4/30,オリジナル,ふたなり,B5
こいしお姉ちゃんにまかせなさい,あ,あるたな,雉派(ちぱ),2017/5/7,東方,-,B5
慰め上手のこいしちゃん,あ,あんみつよもぎ亭,みちきんぐ,2017/8/11,東方,-,B5
奥野田が精通上手で酔魔せん,あ,あんみつよもぎ亭,みちきんぐ,2021/12/31,東方,-,B5
ロマンチック・ランサー,あ,愛味亭,愛味亭うまみ,2018/11/23,FGO,ふたなり,B5
このあとふたなり娘にめちゃくちゃ逆ア〇ルされる,あ,愛味亭,愛味亭うまみ,2019/12/30,オリジナル,ふたなり,B5
ハリガネモガミン,あ,暗黒暴走組,アイヌマニア,2019/8/12,艦これ,もがみん,B5
の裏,あ,新井カズキ,新井カズキ,2016/12/31,ガールズアンドパンツァー,ふたなり,B5
ふたなりっこエンジェルオーバーキル,あ,青葉Q魔洞,双葉淀夢,2017/5/3,オリジナル,ふたなり,B5
ふたまん! 放課後射精スケッチ,あ,青葉Q魔洞,双葉淀夢,2017/11/11,オリジナル,ふたなり,B5
パンツァーハイのおさめかた3,あ,青葉Q魔洞,双葉淀夢,2017/12/31,ガールズアンドパンツァー,ふたなり,B5
ふたまん! 2 真夜中のふたなりガール ,あ,青葉Q魔洞,双葉淀夢,2018/6/9,オリジナル,ふたなり,B5
ふたなりっこサキュバスラブリーデイズ,あ,青葉Q魔洞,双葉淀夢,2018/8/12,オリジナル,ふたなり,B5
パンツァーハイのおさめかた4,あ,青葉Q魔洞,双葉淀夢,2018/11/23,ガールズアンドパンツァー,ふたなり,B5
裏スペクタクル,あ,赤い除雪車,おじポン,2024/5/10,艦これ,-,A5
お〇ん〇んお掃除しながら元帥タッチ攻略,い,EASY MODE HEROS,あなくろ,2021/12/30,アズールレーン,ふたなり,B5
バーチャルY〇uTuber娘初雪ちゃんのオナホ実況商品レビュー,い,EASY MODE HEROS,あなくろ,2021/12/30,艦これ,ふたなり,B5
M.F.H.H. MP2,い,In ART THEATER,FRED=KELLY,2003/12/30,みるもDEポン,-,B5
SOLDIER BLUE,い,INFINITY DRIVE,京極しん,2011/8/14,ストライクウィッチーズ,-,B5
Noblesseoblige ,い,INFINITY DRIVE,京極しん,2013/4/28,ストライクウィッチーズ,-,B5
Boyish Mellow,い,INFINITY DRIVE,京極しん,2015/5/2,艦これ,もがみん,B5
MO,い,INFINITY DRIVE,京極しん,2015/8/16,艦これ,もがみん,B5
大人には,い,いずみ屋,和泉彪,2018/12/30,FGO,ふたなり,B5
稲荷屋さんちのまぜ本!ぐだぐだオブワイルド,い,稲荷屋,稲荷,2017/4/30,FGO,ゼルダ,B5
わるいこミカはおしおきされたい,い,陰謀の帝国,印カ・オブ・デッド,2023/5/7,ブルーアーカイブ,-,B5
カーテンコールと呼ぶには甘美過ぎた,う,virophilia,織日ちひろ,2022/9/25,ニジガク,ふたなり,B5
月海の果て,う,virophilia,織日ちひろ,2022/12/31,ニジガク,ふたなり,B5
発情義妹和泉紗霧開発性活,う,waterwheel,白田太,2017/8/13,エロマンガ先生,-,B5
ZARAX,う,魚ウサ王国,魚ウサ王,2016/12/29,艦これ,-,B5
POLAX,う,魚ウサ王国,魚ウサ王,2017/8/11,艦これ,-,B5
ザラとポーラのへべれけないと,う,魚ウサ王国,魚ウサ王,2017/8/11,艦これ,-,B5
恋する乙女は大砲変化!,え,AGM2研,小黒正巳,1999/8/15,コレクターユイ,-,B5
HTSK4.5,え,HTSK,にしゆき,2016/1/31,グランブルーファンタジー,ふたなり,B5
HTSK9,え,HTSK,にしゆき,2018/11/23,FGO,ふたなり,B5
けいじゅん+αぱんつこれくしょん,え,MtU,MtU,2016/12/29,艦これ,-,B5
じゅうじゅん+αぱんつこれくしょん,え,MtU,MtU,2017/8/11,艦これ,-,B5
白血球のひみつ,え,M屋,みこやん,2021/12/31,はたらく細胞,ふたなり,B5
オーガ対ダークエルフ・オーガ繁殖大作戦,え,M屋,みこやん,2022/8/14,オリジナル,ふたなり,B5
オーガ対ダークエルフⅡ・ラヴラヴ!新婚大作戦,え,M屋,みこやん,"	2023/08/13",オリジナル,ふたなり,B5
ふたななじみ,え,SHIS,Zトン,2017/8/13,オリジナル,ふたなり,B5
お嬢様も本気出す,え,えかきびと,えかきびと,2021/12/30,異世界行ったら本気出す,-,B5
ふたなりプランター,え,エフ屋,メッシィ,2015/5/27,オリジナル,ふたなり,B5
ふたなりフレンド,え,エフ屋,メッシィ,2016/9/2,オリジナル,ふたなり,B5
ふたなりガールラブ,え,エフ屋,メッシィ,2016/12/31,オリジナル,ふたなり,B5
ふたなりレイニーディ,え,エフ屋,メッシィ,2017/5/3,オリジナル,ふたなり,B5
ふたなりエルフちゃん,え,エフ屋,メッシィ,2017/11/11,オリジナル,ふたなり,B5
ふたなりエルフちゃんサブクエスト,え,エフ屋,メッシィ,2017/12/31,オリジナル,ふたなり,B5
ふたなりメイドさん朝ミルク,え,エフ屋,メッシィ,2018/6/29,オリジナル,ふたなり,B5
ふたなり彼女 幼少編,え,エフ屋,メッシィ,2018/11/23,オリジナル,ふたなり,B5
ふたなり彼女 成長編,え,エフ屋,メッシィ,2018/12/31,オリジナル,ふたなり,B5
ふたなり彼女のおまけ,え,エフ屋,メッシィ,2019/3/30,オリジナル,ふたなり,B5
いとこのお姉ちゃんとないしょのミルク,え,エフ屋,メッシィ,2019/9/6,オリジナル,ふたなり,B5
ないしょのえっちなスケッチ詰め合わせ,え,エフ屋,メッシィ,2019/12/30,オリジナル,ふたなり,B5
ふたなりエルフ女戦士オナホ化本,え,エフ屋,メッシィ,2021/11/30,オリジナル,ふたなり,B5
ふたなりおねえちゃんあまあませっくす,え,エフ屋,メッシィ,2021/12/31,オリジナル,ふたなり,A4
ふたなりシスターのミルクは美味,え,エフ屋,メッシィ,2022/8/14,オリジナル,ふたなり,B5
ふたなり雪江さんとないしょ尿道姦,え,エフ屋,メッシィ,2023/5/9,オリジナル,ふたなり,B5
ないしょのふたり,え,エフ屋,メッシィ,2023/12/31,オリジナル,ふたなり,B5
ふたなり彼女ととことんいちゃラブH,え,エフ屋,メッシィ,2024/5/4,オリジナル,ふたなり,B5
ふたなりエルフ騎士ヴェルリーナ凌辱搾精監獄,え,エフ屋,メッシィ,2024/8/12,オリジナル,ふたなり,B5
マリーニップル,え,エンテレケイア,ちるまくろ,2016/8/14,DoA,-,B5
サーバルニップル,え,エンテレケイア,ちるまくろ,2017/8/13,けものフレンズ,-,B5
ケッコンずりずり,え,エンテレケイア,ちるまくろ,2017/12/31,アズールレーン,-,B5
ゆめのなかのリップ,え,エンテレケイア,ちるまくろ,2018/8/12,FGO,-,B5
ひなこ育成日誌,え,エンテレケイア,ちるまくろ,2018/12/31,オリジナル,-,B5
ひなこ育成日誌3,え,エンテレケイア,ちるまくろ,2019/8/11,オリジナル,-,B5
アクア様をいじめる本,え,エンテレケイア,ちるまくろ,2019/12/31,ボンバーガール,-,B5
パインにわからせる本,え,エンテレケイア,ちるまくろ,2020/6/23,ボンバーガール,-,B5
ヒモ神さまとひと晩中体液交換,え,エンテレケイア,ちるまくろ,2023/12/17,ダンまち,-,B5
レムの可愛さも鬼がかっている,お,odin,黒川IZUMI,2016/8/13,Reゼロから始める異世界生活,-,B5
マシュマシュ溢れてきちゃいマシュ,お,odin,黒川いづみ,2017/4/30,FGO,-,B5
薫冬優子お借りします,お,OrangeMaru,JP06,2021/8/9,アイドルマスター,-,B5
タマヒメサマ,お,おぞね,まるみや,2021/7/31,オリジナル,ふたなり,B5
ふたちゃん キャラブック・プラス,お,おぞね,まるみや,2021/7/31,オリジナル,ふたなり,B5
ママタマ,お,おぞね,まるみや,2021/7/31,オリジナル,ふたなり,B5
お子様プリンアラモード15,お,お子様ランチ,西野沢かおり介,2008/8/17,オリジナル,-,B5
お子様プリンアラモードFINAL,お,お子様ランチ,西野沢かおり介,2008/12/30,オリジナル,-,B5
お子様ワンタッチセレクションVol.3,お,お子様ランチ,西野沢かおり介,2013/6/2,オリジナル,-,B5
めがしーしー+,お,お子様ランチ,西野沢かおり介,2015/8/13,オリジナル,-,B5
お子様ランチボックス,お,お子様ランチ,西野沢かおり介,2015/12/31,よろず,-,B5
姪と夜ふかし,お,お子様ランチ,西野沢かおり介,2018/8/12,オリジナル,-,B5
御手洗さん、目覚める。,お,お子様ランチ,西野沢かおり介,2019/5/3,オリジナル,-,B5
80'sガールズ(コピー本),お,お子様ランチ,西野沢かおり介,2021/3/28,よろず,-,B5
御手洗さん、告白する。,お,お子様ランチ,西野沢かおり介,2021/12/31,オリジナル,-,B5
めがさいみん,お,お子様ランチ,西野沢かおり介,2023/8/13,オリジナル,-,B5
続・姪と温泉旅行に,お,お子様ランチ,西野沢かおり介,2023/9/3,オリジナル,-,B5
ZOIDSネタまとめ本,お,お子様ランチ,西野沢かおり介,2023/12/31,ゾイド,-,B5
御手洗さん、剃毛する。,お,お子様ランチ,西野沢かおり介,2023/12/31,オリジナル,-,B5
妹・オブ・ザ・デッド The Beginning,お,お子様ランチ,西野沢かおり介,2024/5/26,オリジナル,-,B5
逆境(ルーミ),お,御機械屋,OMECHA,1995/8/20,ギャラクシーファイト,-,B5
大人のおもちゃ8巻 双葉のお話,お,大人のおもちゃ,楊広川,2018/9/22,オリジナル,ふたなり,B5
某芸能事務所盗撮画像流出まとめ,か,COUNTER-CENSORSHIP,オオカミうお,2022/12/31,アイドルマスター,-,B5
某芸能事務所盗撮画像流出まとめ2,か,COUNTER-CENSORSHIP,オオカミうお,2023/8/13,アイドルマスター,-,B5
某芸能事務所盗撮画像流出まとめ3,か,COUNTER-CENSORSHIP,オオカミうお,2024/1/2,アイドルマスター,-,B5
某芸能事務所盗撮画像流出まとめ4,か,COUNTER-CENSORSHIP,オオカミうお,2024/8/12,アイドルマスター,-,B5
ふたなりスケッチ3,か,ガジェット工房,A-10,2016/5/3,ひだまりスケッチ,ふたなり,B5
ふたなりスケッチ4,か,ガジェット工房,A-10,2017/5/3,ひだまりスケッチ,ふたなり,B5
浦本OMF,か,カズ屋,由浦カズヤ,2018/8/12,オリジナル,ふたなり,B5
あなたはあなたちゃん,か,かにどうらく,かにばさみ,2022/8/13,ニジガク,ふたなり,B5
温泉で勃起したハッカドール3号,か,かにみそ屋,かにかま,2017/8/13,ハッカドール,-,B5
射精を我慢するハッカドール3号,か,かにみそ屋,かにかま,2017/12/31,ハッカドール,-,B5
あんこといっしょ!,か,かにみそ屋,かにかま,2018/8/12,まどかマギカ,-,B5
鹿目さんとあんこちゃん,か,かにみそ屋,かにかま,2018/12/31,まどかマギカ,-,B5
権力者に逆らえず2コマ堕ちする本,か,かにみそ屋,かにかま,2019/8/12,よろず,-,B5
ち〇こが生えたやすなの本,か,かにみそ屋,かにかま,2019/12/30,キルミーベイベー,ふたなり,B5
ふたちきゅ,か,かまた,かまた,2013/5/6,オリジナル,ふたなり,B5
ふたなり秋山殿が冷泉さんでパンツァーハイ!!,か,カムリズム,鬼頭サケル,2018/8/12,ガールズアンドパンツァー,ふたなり,B5
ふたなり秋山殿が西住さんでパンツァーハイ!!,か,カムリズム,鬼頭サケル,2018/12/31,ガールズアンドパンツァー,ふたなり,B5
ふたなり冷泉さんが竹部さんでパンツァーハイ!!,か,カムリズム,鬼頭サケル,2019/8/12,ガールズアンドパンツァー,ふたなり,B5
クソザコま〇こキャルちゃんち〇ぽきしくん,か,カムリズム,鬼頭サケル,2022/8/14,プリンセスコネクト,-,B5
トキの勃起力改善パーフェクトトレーニング,か,カムリズム,鬼頭サケル,2023/8/13,ブルーアーカイブ,-,B5
セミナー書記生塩ノアによる逆ちんぽ管理記録,か,カムリズム,鬼頭サケル,2023/12/31,ブルーアーカイブ,-,B5
カポエラ美人,か,かるま屋,かるま龍狼,1998/8/16,カードキャプターさくら,ふたなり,B5
ふたなりあくとれず! おへやえっち編,か,カンチラカンパニー,ぎゅーどん,2023/8/12,アリスギア,ふたなり,B5
FUTAqours side-You,か,火愚夜姫工房,月下火愚夜姫,2018/8/12,ラブライブ,ふたなり,B5
我が鎮守府はマイクロビキニを採用しました,か,開栓注意,篤屋工業,2016/8/13,艦これ,-,B5
ドイツ艦と子作りしよう,か,開栓注意,篤屋工業,2016/12/29,艦これ,-,B5
コハルフタナル,か,核座頭,核座頭,2023/12/31,ブルーアーカイブ,ふたなり,B5
突然炎がごとく第二版,か,革命政府広報室,ラヂヲヘッド,2017/9/3,アイドルマスター,ふたなり,B5
モテないしガマンするのやめる,か,革命政府広報室,ラヂヲヘッド,2019/10/20,わたモテ,ふたなり,B5
夢見りあむふたなり炎上配信,か,革命政府広報室,ラヂヲヘッド,2022/8/14,アイドルマスター,ふたなり,B5
ぼっき・ざ・でぃっく!,か,革命政府広報室,ラヂヲヘッド,2023/12/31,ぼっち・ざ・ろっく!,ふたなり,B5
主将は練習がしたい!,か,関西オレンジ,荒井啓,2018/12/31,メジャー2,-,B5
梱包少女EX,く,Clochette,咲良ゆき,2022/12/31,オリジナル,-,B5
401染 すべてが白になる日,く,CrowView,たじ,2016/5/1,艦これ,-,B5
浦波、承りました…,く,CrowView,たじ,2016/12/31,艦これ,-,B5
ショウトツカイキン?,く,くまのとおるみち,くまだ,2016/8/13,艦これ,もがみん,B5
ミカと初めての共同作業,く,ぐりいん野はうす,温野りょく,2022/12/30,ブルーアーカイブ,-,B5
ミカとHする本,く,ぐりいん野はうす,温野りょく,2023/8/12,ブルーアーカイブ,-,B5
ふたなり48手指南線画集,く,ぐるぐる本舗,池田和宏,2021/6/6,オリジナル,ふたなり,B5
大晦日だョ!怒りの干支レース,く,ぐるぐる本舗,池田和宏,2021/12/31,オリジナル,ふたなり,B5
コハルとスケベする本,く,くれり亭,くれりて,2023/8/12,ブルーアーカイブ,-,B5
レンゲとこづくりセックスする本,く,くれり亭,くれりて,2023/12/30,ブルーアーカイブ,-,B5
あざやか,く,空中線,マキオ,2019/12/29,艦これ,赤城,B5
SuperLative!,く,空中線,マキオ,2021/2/14,艦これ,もがみん,B5
シャララ,く,空中線,マキオ,2021/11/21,艦これ,もがみん,B5
ほんもの,く,空中線,マキオ,2022/12/30,艦これ,沖波,B5
セーラー 艦これ漫画短編集,く,空中線,マキオ,2023/8/12,艦これ,もがみん,B5
ADVENTURE,く,空中線,マキオ,2023/12/30,ガンダム,水星・ニカ,B5
サブマリン707RX,く,黒汐物産,岡昌平,2004/8/14,サブマリン707,-,B5
日本昔クソ話,け,K2マンホール,P,2018/8/12,オリジナル,-,B5
春のつづき,け,ゲルピン,水無月十三,2018/8/12,プリキュア,ふたなり,B5
鳥海さんも及ばれしたい!,け,けんろー工房,おりもとみまな,2016/12/31,艦これ,-,B5
Fantazio KAJ Realo 5&6合併号,け,幻想プロジェクト,幻想プロジェクト,1987/3/15,ガンダム,-,B5
ふた娘に悪戯しちゃいけません安藤恵編,こ,Contamination,eigetu,2018/6/17,オリジナル,ふたなり,B5
褐色こくまろ噴乳メイド,こ,GOLD KOMAN SEX,バクシーシAT,2017/8/13,オリジナル,-,B5
あなたの●●何センチ?,こ,こくまろ調整豆乳,オーマンズリーダス,2022/8/14,オリジナル,-,A4
SF-MECHANIC Part2,こ,コミック・ナット,岩気祐司,1985/8/11,オリジナル,-,B5
コミックガムNekoMimi Mode2004,こ,コミックガム,コミックガム,2004/12/1,月詠 -MOON PHASE-,,B5
魔法英雄物語,こ,コミックぴか,恋緒みなと,1990/8/19,オリジナル,-,B5
皇帝特権EX,こ,極彩色,彩社長,2017/4/30,Fate,ふたなり,B5
姦これ鎮守府轟沈,こ,小判屋,さめだ小判,2014/8/17,艦これ,-,B5
最上と秘密の温泉旅行,こ,小判屋,さめだ小判,2016/8/14,艦これ,もがみん,B5
たまみこ,こ,蒟蒻鍋,magifuro蒟蒻,2017/8/13,オリジナル,ふたなり,B5
ASS掘るフォくん2霊衣開放編,こ,蒟蒻鍋,magifuro蒟蒻,2017/11/11,FGO,ふたなり,B5
めちゃシコしちゃう系女子,こ,蒟蒻鍋,magifuro蒟蒻,2017/12/31,オリジナル,ふたなり,B5
よわよわふたなりサキュバスちゃん01,こ,蒟蒻鍋,magifuro蒟蒻,2018/8/12,オリジナル,ふたなり,B5
ふたなりゆかりさんVSバーチャル空間,こ,蒟蒻鍋,magifuro蒟蒻,2018/11/23,ボイロ,ふたなり,B5
よわよわふたなりサキュバスちゃん02,こ,蒟蒻鍋,magifuro蒟蒻,2018/12/31,オリジナル,ふたなり,B5
よわよわふたなりサキュバスちゃん03,こ,蒟蒻鍋,magifuro蒟蒻,2019/8/11,オリジナル,ふたなり,B5
フタナリミルクティー,こ,蒟蒻鍋,magifuro蒟蒻,2019/9/23,オリジナル,ふたなり,B5
よわよわふたなりサキュバスちゃん04,こ,蒟蒻鍋,magifuro蒟蒻,2019/12/30,オリジナル,ふたなり,B5
乳首が弱いふたなりゆかりさん,こ,蒟蒻鍋,magifuro蒟蒻,2020/2/11,ボイロ,ふたなり,B5
ふたなりオナニズム,こ,蒟蒻鍋,magifuro蒟蒻,2020/11/3,オリジナル,ふたなり,B5
ふたなりちゃんすぐイく,こ,蒟蒻鍋,magifuro蒟蒻,2021/11/21,オリジナル,ふたなり,B5
ふたなり娘はスッキリしたい,こ,蒟蒻鍋,magifuro蒟蒻,2022/11/3,オリジナル,ふたなり,B5
ふたなりちんちんの陳情,こ,蒟蒻鍋,magifuro蒟蒻,2023/5/4,オリジナル,ふたなり,B5
なかなかイけないふたなり娘,こ,蒟蒻鍋,magifuro蒟蒻,2023/8/13,オリジナル,ふたなり,B5
ふたなり娘と男の娘がイチャラブする話,こ,蒟蒻鍋,magifuro蒟蒻,2023/10/9,オリジナル,ふたなり,B5
ふたなり娘はいつもとちがう,こ,蒟蒻鍋,magifuro蒟蒻,2023/12/31,オリジナル,ふたなり,B5
ケダモノフレンズサプライズ,さ,SERVICE HEAVEN,ハヤシ,2017/8/17,けものフレンズ,-,B5
山郷ハラスメント,さ,ザ・バナナピストルズ,山吉ファン太,2018/8/11,ガールズアンドパンツァー,-,B5
山郷エンゲージ,さ,ザ・バナナピストルズ,山吉ファン太,2019/12/28,ガールズアンドパンツァー,-,B5
Project Sicorpio,さ,サークルQUDA,Qudamono,2017/4/30,オリジナル,ふたなり,B5
生えも2,さ,サークルとこやま,とこやまけいた,2019/12/28,プリチャン,-,B5
秘書艦最上くんの場合,さ,サシミノイワ,しでん,2017/12/31,艦これ,もがみん,B5
Once and again!!,さ,サヨナラホーネット,ヨシラギ,2017/12/29,FGO,ふたなり,B5
OJY1DVI2,さ,サヨナラホーネット,ヨシラギ,2018/12/31,FGO,-,B5
徐福ちゃんなんかで卒業したくないやい!,さ,サルパッチョ,わいら,2023/8/13,FGO,-,B5
メリュ子はぐいぐい来るが交尾がド下手。,さ,サルパッチョ,わいら,2023/12/31,FGO,-,B5
ふたなり化及び性欲増強アーツ 経過観察記録 術師編,さ,さんどるまん,みりちく,2023/3/12,アークナイツ,ふたなり,A5
なこXなこ,し,C.R's NEST,しーあーる,2018/8/12,サムライスピリッツ,ふたなり,B5
ふたなり剣士シズクの受難 触手鎧編,し,C.R's NEST,しーあーる,2018/11/23,オリジナル,ふたなり,B5
ふたなり何ガロン射精せる?,し,C.R's NEST,しーあーる,2019/9/23,ダンベル何キロ持てる?,ふたなり,B5
天使くんレビュアーズ,し,C.R's NEST,しーあーる,2020/3/21,異種族レビュアーズ,ふたなり,B5
Valkyrie Spear,し,C.R's NEST,しーあーる,2020/8/8,聖剣伝説,ふたなり,B5
えるゔん ぼう,し,C.R's NEST,しーあーる,2021/11/21,オリジナル,ふたなり,B5
Cursed Holy Clothes2,し,C.R's NEST,しーあーる,2022/11/3,ダークアドベント,ふたなり,B5
E.C.C.C.M.,し,sys3.6.3.,ザンクロー,2004/12/30,オリジナル,-,B5
TYPE 1,し,sys3.6.3.,ザンクロー,2008/8/17,オリジナル,-,B5
TYPE 2 オーディンサーガ アートワークス,し,sys3.6.3.,ザンクロー,2010/8/16,オリジナル,-,B5
VARIANT PURIFICATION,し,sys3.6.3.,ザンクロー,2014/12/30,オリジナル,-,B5
VARIANT PURIFICATION2,し,sys3.6.3.,ザンクロー,2015/8/16,オリジナル,-,B5
VARIANT PURIFICATION3,し,sys3.6.3.,ザンクロー,2015/12/31,オリジナル,-,B5
PEROPERO CANDY,し,sys3.6.3.,ザンクロー,2016/8/14,オリジナル,-,B5
TENDER PURIFICATION,し,sys3.6.3.,ザンクロー,2016/12/31,オリジナル,-,B5
提督はどーしても能代とHがしたい!!,し,じぇのばけーき,たかやKi,2016/8/14,艦これ,-,B5
うきうきCRISIS,し,ししゃもハウス,西野靖博,1986/12/28,オリジナル,-,B5
ガルパン授乳部。,し,ジャックとニコルソン,のりパチ,2017/12/31,ガールズアンドパンツァー,-,B5
郵便受けにネズみだの虫だの死骸入れるのやめろっつってんだろ!!,し,紙魚丸製作所,紙魚丸,2024/2/12,ヤニねこ,-,B5
Re:ゼロから始める異世界イチャラブ結婚生活,し,紙切ればさみ,やすゆき,2016/8/14,Reゼロから始める異世界生活,-,B5
ふぇちこれ04,し,自宅vacation,うるりひ,2016/8/14,艦これ,浜風,B5
ロッテにお尻弄られる本,し,七面楚歌,すたーきー,2011/8/14,ロッテのおもちゃ,-,A5
ピンクの悪魔にお尻弄られる本,し,七面楚歌,すたーきー,2018/11/23,GGO,ふたなり,B5
上野さんにお尻弄られる本,し,七面楚歌,すたーきー,2019/8/11,上野さんは不器用,ふたなり,B5
くろしおおふろとりっぷ,し,捨八secの彼方(じゅっぱーせくのかなた),五月猫,2016/12/29,艦これ,-,B5
爆弾ピエロ,し,樹莱里,樹莱里,2001/7/1,エスプレイド,-,B5
出会った記憶なんてなかった,し,熟成角砂糖,sugarBt,2021/12/30,プリキュア,ふたなり,B5
ニムちゃんは四六時中構われたい,し,常時無常,篠塚譲二,2017/4/30,艦これ,-,B5
AUUUUUUN!,し,常時無常,篠塚譲二,2019/4/29,アリスギア,-,B5
エリタマ,し,真珠貝,武田弘光,2014/8/17,ラブライブ,エリチ,B5
源さん2,し,敷島贋具,敷島天気,2009/8/16,かのこん,-,B5
淑女図鑑1,し,敷島贋具,敷島天気,2010/8/15,れでぃばと,-,B5
TRASH BOX3,す,SNOB NERD WORKS,さめだ小判,2010/12/31,よろず,-,B5
TRASH BOX4,す,SNOB NERD WORKS,さめだ小判,2012/12/31,よろず,-,B5
姦これ提督が性的な目でしか艦娘を見てくれなくてつらい,す,SNOB NERD WORKS,さめだ小判,2013/12/31,艦これ,-,B5
結月ゆかりフタナリチンポRTA,す,Stapspats,翡翠石,2018/8/12,ボイロ,ふたなり,B5
成子坂製作所艶戯録2「怜編」,す,Studio G-Power!,SASAYUKi,2018/12/31,アリスギア,-,B5
成子坂製作所艶戯録3「チーム:NRtS編」,す,Studio G-Power!,SASAYUKi,2019/8/12,アリスギア,-,B5
成子坂製作所艶戯録4,す,Studio G-Power!,SASAYUKi,2019/12/31,アリスギア,-,B5
SAMPLE vol.3,す,STUDIO SAMPLE,けら,1991/8/16,あさりよしとお,-,B5
SWEET COCONUTS3,す,STUDIO一喝魔人,ざっくばらん,1993/12/30,本所和子,-,B5
RETAKE4,す,スタジオKIMIGABUCHI,スタジオKIMIGABUCHI,2006/8/11,エヴァンゲリオン,-,B5
RETAKE After,す,スタジオKIMIGABUCHI,スタジオKIMIGABUCHI,2006/12/29,エヴァンゲリオン,-,B5
comicメディア VOL.0,す,スタジオSFC,スタジオSFC,1985/3/1,アニパロ,-,B5
Paろでぃっく3,す,スタジオSFC,スタジオSFC,1986/8/10,アニパロ,-,B5
ツチノコのチンチン天国射精地獄,す,すみからすみまで,ガビョ布,2022/12/31,けものフレンズ,ふたなり,B5
彼方ちゃんと陰茎付侑ちゃん,す,酢飯部,酢飯部,2022/7/10,ニジガク,ふたなり,B5
改淫懲悪みるきぃぽぷら,す,水中ホワイト,かるぴ,2018/8/12,オリジナル,ふたなり,B5
ふたなり解像されちゃう弊カルデア,す,水中ホワイト,かるぴ,2018/12/31,FGO,ふたなり,B5
ふたなり解像されちゃう弊カルデア2,す,水中ホワイト,かるぴ,2019/12/30,FGO,ふたなり,B5
TINPO ILLUSTRATION,す,水密桃工房,モモの水道水,2018/6/9,アイドルマスター,ふたなり,B5
雪ちんぽ ふたなり雪歩と律子がレッスンする本,す,水密桃工房,モモの水道水,2018/8/12,アイドルマスター,ふたなり,B5
雪ちんぽ ふたなり雪歩と亜美真美が秘密の特訓する本,す,水密桃工房,モモの水道水,2018/12/31,アイドルマスター,ふたなり,B5
