タイトル,発行,発売日,刷数,ジャンル,状態
ポニーテールソフト美少女アルバム,徳間書店,1991/6/25,1版1刷,PCゲーム,帯付き
ミンク原画集,創芸社,1994/9/15,1版1刷,PCゲーム,帯無し
VIPER Series イラスト原画集,COMPASS,1994/12/10,1版1刷,PCゲーム,帯無し
TABOO原画集,笹倉出版社,1995/10/10,1版1刷,PCゲーム,帯無し
YES!HG原画集,辰巳出版,1995/12/20,1版1刷,PCゲーム,帯無し
カクテルソフト原画集,ワコー出版,1996/4/15,1版1刷,PCゲーム,帯無し
メイビーソフト原画集,笹倉出版社,1996/5/1,1版1刷,PCゲーム,帯無し
フォスター原画集 楽園美少女図鑑,ワコー出版,1996/8/10,1版1刷,PCゲーム,帯無し
アクティブ原画集,笹倉出版社,1996/8/25,1版1刷,PCゲーム,帯無し
SOGNA ILLUSTRATIONS,COMPASS,1997/5/1,1版1刷,PCゲーム,帯無し
VIPER Series イラスト原画集3,COMPASS,1997/12/1,1版1刷,PCゲーム,帯付き
SOGNA ILLUSTRATIONS II,COMPASS,1999/4/20,1版1刷,PCゲーム,帯付き
終末の過ごし方Official Art Works,親声社,1999/7/28,1版1刷,PCゲーム,帯付き
メルティマニア 全メルティランサーシリーズ完全ファンブック,ケイブンシャ,1999/10/5,1版1刷,PCゲーム,帯無し
こみっくパーティー ビジュアルファンブック,メディアワークス,2002/7/20,1版1刷,PCゲーム,帯付き
終末の過ごし方Official Art Works 復刻改訂版,エンターブレイン,2003/4/24,1版1刷,PCゲーム,帯付き
まほろまてぃっくあどべんちゃーパーフェクトガイド,角川書店,2003/8/20,1版1刷,PCゲーム,帯付き
ぽぽたん ろっくちゃんのひみつの絵本,角川書店,2003/9/30,1版1刷,PCゲーム,帯無し
はっちゃけHARDなあやよさん本,BEEP,2018/9/1,1版1刷,PCゲーム,DVD付き
ギャルズアイランド2,新声社,1993/2/28,1版1刷,アーケード,帯無し
アリスソフト美少女アルバム,徳間書店,1991/10/30,1版1刷,アリスソフト,帯付き
ALICE SOFT ILLUSTRATIONS アリスのらくがき帳,COMPASS,1993/5/10,1版1刷,アリスソフト,帯付き
鬼畜王ランス,ソフトバンク,1997/2/28,1版1刷,アリスソフト,帯付き
闘神都市II 原画&設定資料集,ソフトバンク,2000/4/3,1版11刷,アリスソフト,帯無し
アリスのえほん,アリスソフト,2000/12/7,1版1刷,アリスソフト,帯無し
リ・クルスOfficial Guide鳳凰の書,ソフトバンク,2002/1/20,1版1刷,アリスソフト,帯無し
同級生原画集,辰巳出版,1993/7/5,1版1刷,エルフ,帯無し
同級生2完全ガイド,辰巳出版,1995/5/30,1版1刷,エルフ,帯無し
ドラゴンナイト4完全ガイド,辰巳出版,1997/2/1,1版9刷,エルフ,帯付き
YU-NO完全ガイド,辰巳出版,1998/3/25,1版5刷,エルフ,帯付き
ビ・ヨンド完全ガイド C/W:恋姫,辰巳出版,2001/1/10,1版1刷,エルフ,帯付き
ファミコン非公認ゲームガイド,マイウェイ出版,2019/2/5,1版1刷,カタログ,帯無し
蘇る20世紀アーケードゲーム大全Vol.1,メディアパル,2019/12/9,1版2刷,カタログ,帯付き
CONTINUE SPECIAL PCエンジン,太田出版,2020/4/13,1版2刷,カタログ,帯付き
MSXパーフェクトカタログ,ジーウォーク,2020/6/28,1版1刷,カタログ,帯無し
PC-8801パーフェクトカタログ,ジーウォーク,2022/6/16,1版1刷,カタログ,帯付き
PC-9801パーフェクトカタログ 上巻一般ゲーム編,ジーウォーク,2023/1/27,1版1刷,カタログ,帯付き
PC-9801パーフェクトカタログ 下巻美少女ゲーム編,ジーウォーク,2023/2/27,1版1刷,カタログ,帯無し
蘇る不滅のシューティングゲーム大全Vol.2,メディアパル,2023/3/19,1版1刷,カタログ,帯付き
蘇る不滅のシューティングゲーム大全Vol.4,メディアパル,2023/9/18,1版1刷,カタログ,帯付き
スーパーリアル麻雀P5豆本1巻 遠野みづき,セタ,1994/11/1,1版1刷,スーパーリアル麻雀,帯無し
スーパーリアル麻雀P5豆本2巻 藤原綾,セタ,1994/11/1,1版1刷,スーパーリアル麻雀,帯無し
スーパーリアル麻雀P5豆本3巻 早坂晶,セタ,1994/11/1,1版1刷,スーパーリアル麻雀,帯無し
スーパーリアル麻雀P6 豆本1巻 香山タマミ,セタ,1996/3/1,1版1刷,スーパーリアル麻雀,帯無し
スーパーリアル麻雀P6 豆本2巻 来宮ゆかり,セタ,1996/3/1,1版1刷,スーパーリアル麻雀,帯無し
スーパーリアル麻雀P6 豆本3巻 栗原真理,セタ,1996/3/1,1版1刷,スーパーリアル麻雀,帯無し
スーパーリアル麻雀P7 豆本1巻 麻比奈百合奈,セタ,1997/1/1,1版1刷,スーパーリアル麻雀,帯無し
スーパーリアル麻雀P7 豆本2巻 麻比奈夏姫,セタ,1997/1/1,1版1刷,スーパーリアル麻雀,帯無し
スーパーリアル麻雀P7 豆本4巻 豊原エツ子,セタ,1997/1/1,1版1刷,スーパーリアル麻雀,帯無し
スーパーリアル麻雀IV原画&設定資料集,ソフトバンク,1994/4/5,1版2刷,スーパーリアル麻雀IV,帯付き
ファンタシースター公式設定資料集,ソフトバンク,1995/11/15,1版1刷,セガ,帯無し
セガハードヒストリア,ソフトバンク,2021/7/31,1版1刷,セガ,セガハードヒストリア
歴代セガハード専門誌総覧,ソフトバンク,2021/7/31,1版1刷,セガ,セガハードヒストリア
ALL ABOUT NAMCO 復刻版,電波新聞社,2020/8/31,1版1刷,ナムコ,帯無し
ALL ABOUT NAMCO2 復刻版,電波新聞社,2021/4/20,1版1刷,ナムコ,帯無し
nintendo3DSオールソフトカタログ,任天堂,2018/12/1,1版1刷,パンフレット,プリペイド使用済み
アーケードアーカイブス アケアカEOGEO大百科,ハムスター,2020/12/30,1版1刷,パンフレット,帯無し
ポケットモンスタースカーレットバイオレット,任天堂,2021/12/1,1版1刷,パンフレット,帯無し
ポケモンレジェンズ アルセウス,角川書店,2021/12/1,1版1刷,パンフレット,帯無し
君が遊んだのはどのポケモン?,角川書店,2021/12/1,1版1刷,パンフレット,帯無し
ゲームレガシーVol.1,ゲームインパクト,2022/10/22,1版1刷,パンフレット,帯無し
はじめてのファイアーエムブレム ファイアーエムブレムエンゲージ,任天堂,2022/12/1,1版1刷,パンフレット,帯無し
アストロ忍者マン忍法帖,三才ブックス,2022/11/28,1版1刷,ファミコン,CD付き
ブルーアーカイブ オフィシャルアートワークス,一迅社,2022/11/4,1版2刷,ブルーアーカイブ,帯付き
マール王国白書,KSS BOOKS,2000/4/30,1版1刷,マール王国,帯付き
メガドライブミニ パーフェクトブック,角川書店,2019/9/19,1版1刷,メガドライブ,帯無し
BEEPメガドライブFAN,徳間書店,2019/10/5,1版1刷,メガドライブ,DVD付き
メガドライブミニ2 パーフェクトブック,角川書店,2022/10/27,1版1刷,メガドライブ,冊子付
BEEPメガドライブFAN2,徳間書店,2022/11/10,1版1刷,メガドライブ,DVD付き
艦これ公式作戦記録,宝島社,2014/4/20,1版2刷,艦これ,ポスター付き
艦これジャーナル 艦娘たちのお正月,角川書店,2015/1/1,1版1刷,艦これ,CDポスター付き
提督報告書,エンターブレイン,2015/1/13,1版2刷,艦これ,ポスター付き
お嬢様通信DX,ホビージャパン,1996/7/19,1版1刷,銀河お嬢様伝説ユナ,帯無し
銀河お嬢様伝説ユナ 公式設定資料集完全版,メディアワークス,1999/3/20,1版1刷,銀河お嬢様伝説ユナ,帯無し
目指せパチプロパチ夫くん 完全攻略テクニカルブック,徳間コミュニケーションズ,1988/12/30,1版1刷,攻略本,帯無し
必勝完ペキ本 探偵神宮寺三郎横浜港連続殺人事件,徳間書店,1989/4/15,1版1刷,攻略本,帯無し
任天堂公式ガイドブック スーパーマリオワールド,小学館,1991/4/10,1版3刷,攻略本,帯無し
サガ3 基礎データ編,NTT出版,1991/12/18,1版1刷,攻略本,帯無し
任天堂公式ガイドブック スーパーマリオカート,小学館,1992/10/20,1版1刷,攻略本,帯無し
任天堂公式ガイドブック スーパーマリオコレクション,小学館,1993/8/10,1版1刷,攻略本,帯無し
任天堂公式ガイドブック ゼルダの伝説夢をみる島,小学館,1993/9/1,1版2刷,攻略本,帯無し
聖剣伝説2 完全攻略編,NTT出版,1993/9/30,1版1刷,攻略本,帯無し
ロマンシングサガ2 冒険ガイドブック,NTT出版,1993/12/6,1版1刷,攻略本,帯無し
ドラゴンクエスト4公式ガイドブック下巻 知識編,エニックス,1994/6/20,1版26刷,攻略本,帯無し
任天堂マザー2 最終攻略読本,ジャパンミックス,1994/12/1,1版1刷,攻略本,帯無し
任天堂公式ガイドブック ゼルダの伝説神々のトライフォース上,小学館,1995/4/1,1版13刷,攻略本,帯無し
聖剣伝説3 基礎知識編,NTT出版,1995/10/13,1版1刷,攻略本,帯無し
任天堂公式ガイドブック ゼルダの伝説神々のトライフォース下,小学館,1995/11/20,1版15刷,攻略本,帯無し
ロマンシングサガ3 冒険ガイドブック,NTT出版,1995/12/25,1版1刷,攻略本,帯無し
ずっといっしょグラフィカルマニュアル,親声社,1998/4/12,1版1刷,攻略本,帯無し
アニマスター 完全攻略ガイド,講談社,2000/6/30,1版1刷,攻略本,帯無し
マザー百科 新装復刻版,小学館,2003/10/1,1版3刷,攻略本,帯付き
虫姫さま INSANITY DVD THE SECRET LOVER,INH,2006/2/14,1版1刷,攻略本,DVD付き
アマガミ オフィシャルコンプリートガイド,エンターブレイン,2009/5/7,1版1刷,攻略本,帯付き
甲虫王者ムシキングANNIVERSARY20th,宝島社,2023/8/21,1版1刷,甲虫王者ムシキング,カード付
アルファ・システム サーガ,樹想社,2004/2/3,1版1刷,社史,帯付き
サンソフトクロニクル,太田出版,2023/10/6,1版1刷,社史,帯付き
ALL ABOUT DATA EAST,電波新聞社,2023/11/23,1版1刷,社史,帯無し
ゲーセンミュージアム 日本ゲーム博物館所蔵品カタログVol.1,小牧ハイウェイ企画,2021/6/1,1版1刷,図録,帯無し
アーケードゲーム・タイポグラフィ,グラフィック社,2022/1/25,1版1刷,図録,帯無し
ゲームコンソール2.0,オーム社,2022/7/20,1版1刷,図録,帯付き
アマガミ Various Artists 0,エンターブレイン,2011/1/27,1版1刷,特典,カード付
バトルガレッガ20thメモリアルブック BLUESCAPE,M2,2016/12/15,1版1刷,特典,帯無し
ゲーム天国 Memorial Works,シティコネクション,2017/11/30,1版1刷,特典,帯無し
ゲーム天国 録音台本,シティコネクション,2017/11/30,1版1刷,特典,帯無し
ダライアス コズミックコレクション ダライアスオデッセイ,タイトー,2019/2/28,1版1刷,特典,帯無し
エスプレイド ビギナーズガイドブックESP者への道,M2,2019/12/19,1版1刷,特典,帯無し
エスプレイド復刻公式設定資料集,M2,2019/12/19,1版1刷,特典,帯無し
moon noot Back Stage '97,角川書店,2020/10/15,1版1刷,特典,帯無し
天穂のサクナヒメ Artbook(海外版),XSEED,2020/11/12,1版1刷,特典,帯無し
コットンReboot! スペシャルガイドブック,BEEP,2021/2/25,1版1刷,特典,帯無し
ダライアス コズミックリベレーション ダライアスオデッセイ,タイトー,2021/2/25,1版1刷,特典,帯無し
ダライアスオデッセイ COZMIC ARCHIVES INTERNATIONAL Ver,タイトー,2021/4/3,1版1刷,特典,帯無し
アーシャinモンスターワールド ART BOOK,スタジオアートディンク,2021/4/22,1版1刷,特典,帯無し
モンスターワールド4 キャラクターブック,スタジオアートディンク,2021/4/22,1版1刷,特典,帯無し
スペースインベーダー公式資料集,タイトー,2021/7/29,1版1刷,特典,帯無し
月姫マテリアル1,タイプムーン,2021/8/26,1版1刷,特典,帯無し
究極マニュアル燃えよTIGER,M2,2021/10/28,1版1刷,特典,帯無し
イ沼文書,RS34,2021/11/18,1版1刷,特典,帯無し
コットン大全集,サクセス,2021/12/23,1版1刷,特典,帯無し
電撃タイトーステーション Vol.1,タイトー,2022/3/2,1版1刷,特典,帯無し
BEEPサメフライング,M2,2022/4/28,1版1刷,特典,帯無し
弾幕魂本,MAGES,2022/9/29,1版1刷,特典,帯無し
WONDER BOY COLLECTION HISTORY ARTBOOK,ININ,2022/12/8,1版1刷,特典,帯無し
電撃タイトーステーション Vol.3,タイトー,2022/12/21,1版1刷,特典,帯無し
電撃タイトーステーション Vol.2,タイトー,2022/12/22,1版1刷,特典,帯無し
ALESTE History,M2,2022/12/24,1版1刷,特典,帯無し
GG ALESTE3 ARCHIVE+,M2,2022/12/24,1版1刷,特典,帯無し
レイシリーズ公式攻略本,タイトー,2023/3/9,1版1刷,特典,帯無し
レイシリーズ公式資料集,タイトー,2023/3/9,1版1刷,特典,帯無し
BATSUGUN サターントリビュート Boosted 公式ファンブック,シティコネクション,2023/5/25,1版1刷,特典,帯無し
世界樹の迷宮1・2・3 Special Booklet,角川書店,2023/6/1,1版1刷,特典,帯無し
トラブルウィッチーズ The Grimoire of Indigo,ロケットエンジン,2023/7/6,1版1刷,特典,帯無し
怒首領蜂大丈夫,M2,2023/12/7,1版1刷,特典,帯無し
怒首領蜂大往生輪廻転生 オフィシャルアーカイブ,M2,2023/12/7,1版1刷,特典,帯無し
タイトーLDゲームコレクション公式資料集,タイトー,2023/12/14,1版1刷,特典,帯無し
メガドライブ専用 ダライアス PerfectAttack,徳間書店,2019/10/5,1版1刷,付録本,帯無し
メガドライブミニ2 メガ操作マニュアルミニ(パーフェクトブック),角川書店,2022/10/27,1版1刷,付録本,帯無し
