タイトル,サークル名,発行者,発行年,ジャンル,サイズ
トラベルワード100 Aug2022,スタジオたかちょ,たかちょ,2022/8/13,ウマ娘,B5
トラベルワード101 Dec2022,スタジオたかちょ,たかちょ,2022/12/30,ウマ娘,B5
UMA図鑑Vol.2,彼女は石油王,SUOMIAAKI,2022/12/30,ウマ娘,B5
ウル星セブンSUMMARIZE,第四惑星,文月始,2023/12/30,うる星やつら,B5
銀塩万歳,2ちゃんねるカメラ板,小倉弘道,2002/6/1,カメラ,B5
駄ゲー開発ノウハウの本,Gymnopedie,そのたおおぜい,2022/9/11,ゲーム,B5
エフシーBASIC Magazine,okunyon,okunyon,2024/3/30,ゲーム,A5
ビデオゲーム史を巡る冒険シリーズ1 黄金の墓,qbert,qbert,2019/12/31,ゲーム,A5
PC-98/88版「大戦略」開発思い出ノート,エレメンツ工房,石川淳一,2023/12/30,ゲーム,A5
MONACO GP大百科,オニオン製作所,おにたま,2020/11/15,ゲーム,A5
ジャンプバグ大百科,オニオン製作所,おにたま,2021/12/30,ゲーム,A5
100円ディスク ヒストリーブック,オニオン製作所,おにたま,2022/12/30,ゲーム,A5
ミニドライブ大百科,オニオン製作所,おにたま,2023/8/12,ゲーム,A5
セガ汎用筐体ぼんvol.1,きらり屋,Doxsrer,2023/3/28,ゲーム,A5
ナムコ汎用筐体ぼん コンソレット26,きらり屋,Doxsrer,2023/11/23,ゲーム,A5
空前絶後の料理ゲー ラーメン橋開発秘話,ゲームインパクト,利波創造,-,ゲーム,A5
そうだゲームミュージックのひとに訊こう!,スカラベチーム,飴尾拓郎,2019/11/1,ゲーム,B5
そうだゲームミュージックのひとに訊こう!にさつめ,スカラベチーム,飴尾拓郎,2021/4/25,ゲーム,B5
そうだゲームミュージックのひとに訊こう!さんさつめ,スカラベチーム,飴尾拓郎,2022/7/22,ゲーム,B5
決定版ビデオゲーム書籍史入門,すずめ出版,山田鍵,2023/1/1,ゲーム,A5
イース通史1,ハイリスクレボリューション,岩崎啓眞,2019/9/22,ゲーム,B5
イース通史2,ハイリスクレボリューション,岩崎啓眞,2020/1/19,ゲーム,B5
ハドソン伝説・ファミコン編,ハイリスクレボリューション,岩崎啓眞,2021/2/10,ゲーム,B5
ハドソン伝説2・ファミコン編追加エピ,ハイリスクレボリューション,岩崎啓眞,2021/5/31,ゲーム,B5
イース通史3,ハイリスクレボリューション,岩崎啓眞,2021/6/16,ゲーム,B5
イース通史PLUS,ハイリスクレボリューション,岩崎啓眞,2021/6/16,ゲーム,B5
PCエンジンmini制作裏日記,ハイリスクレボリューション,岩崎啓眞,2022/3/6,ゲーム,B5
ハドソン伝説4・CD-ROMの夜明け,ハイリスクレボリューション,岩崎啓眞,2022/8/14,ゲーム,B5
ハドソン伝説0・ハドソン創業編,ハイリスクレボリューション,岩崎啓眞,2023/12/31,ゲーム,B5
ピコライフVol.3,ピコピコテクノロジー,珠-ON,2024/3/24,ゲーム,A5
EXTRA mag #3 2017夏,BEEP,BEEP,2017/9/20,ゲーム,B5
XEVIOUS移植Chronicle,フクタケ的ゲーム研究所,フクタケ,2022/12/30,ゲーム,A5
3-D立体テレビゲーム大図鑑,フクタケ的ゲーム研究所,フクタケ,2023/12/30,ゲーム,A5
スーパーリアル麻雀inGAMEST,へぼきっちゃん,へぼきっちゃん,2020/5/2,ゲーム,B5
京都任天堂巡り,へぼきっちゃん,へぼきっちゃん,2021/12/30,ゲーム,B5
PSK探検隊,もろはのつるぎ,河原野アパラ,2021/2/14,ゲーム,B5
ウィザードリィの深淵 FC版WISの30年,ゆずもデザイン,HED,2017/7/25,ゲーム,B5
ファンタシースター -31年目の原点-,ゆずもデザイン,HED,2018/5/20,ゲーム,B5
LOVE!FANTASYZONE2019,ゆずもデザイン,HED,2019/5/19,ゲーム,B5
ウィザードリィの深淵2,ゆずもデザイン,HED,2019/12/1,ゲーム,B5
脱衣麻雀歴史研究,奥田泰光,奥田泰光,2022/10/22,ゲーム,B5
PCエンジン裏ソフト毒本,華ディスコ,華ディスコ,2020/11/25,ゲーム,B5
ファミコンソフトの作り方 出張版,極楽ほんげら,へけけくん,2021/12/31,ゲーム,A5
ファミコンソフトの作り方3【拡張せよ】拡張音源,極楽ほんげら,へけけくん,2023/8/10,ゲーム,A5
裏ファミコンソフトの作り方 MIDI音源にしちゃおう,極楽ほんげら,へけけくん,2023/8/10,ゲーム,A5
メガドライブの炎  メガディクショナリ完全版,銀河帝国書院,新田陸士長,2023/1/10,ゲーム,B5
PC美少女ゲームの音楽とサントラ,中社D報告書,中社カズサ,2022/8/14,ゲーム,A5
「異世界おじさん」をゲームから考察する本,中社D報告書,中社カズサ,2022/8/14,ゲーム,A5
CPUの訳しかた 6809toZ80,流線堂,Root,2022/12/31,ゲーム,A5
テスト基板 まぼろしゲーム探訪,流線堂,Root,2023/8/12,ゲーム,B5
実質初見のあのゲーム アケアカナムコ編,流線堂,Root,2023/12/30,ゲーム,A5
富士T-1よもやま話,リタイ屋,リタイ屋の梅,2019/12/31,ミリタリー,B5
九七式中戦車公表写真集,国本戦車塾,小玉克幸,2016/6/4,ミリタリー,B5
ロリコンブームの跡を追って外伝1,暗黒拠点月,降間,2021/6/6,ロリコン誌,B5
ロリコンブームの跡を追って増補改訂版,暗黒拠点月,降間,2021/6/6,ロリコン誌,B5
日本海軍の知られざる終焉1 ビルマ方面海軍部隊死闘と生還の記録,PROJECT OST,内田弘樹,2021/8/15,艦これ,B5
追憶の回帰線,スタジオゴンドワナ,有馬桓次郎,2022/8/14,艦これ,B5
MkDocsではじめる静的サイトジェネレータ,P2O,P2O,2023/12/31,技術,B5
PC-8801PR ラズベリーパイ PC-88化計画,Packen Software,FACTORIAN!,2021/12/31,技術,B5
MSX BASICでゲームを作ろう!,ニャオニャオ21世紀,ニャオニャオ21世紀,2021/1/16,技術,A5
MSX BASICでゲームを作ろう!アクションゲーム編,ニャオニャオ21世紀,ニャオニャオ21世紀,2022/2/4,技術,A5
合同誌を作ろう,親方Project,親方Project,2019/4/14,技術,B5
LLMのいま,親方Project,親方Project,2023/12/31,技術,A5
競馬の統計・データ分析をしたい人のためのJRA-VANデータラボ口座,あみすき堂,万灯あお,2023/8/13,競馬,A4
追体験オグリキャップ1(88年編),ドラゴニア,ドラゴニア,2022/8/13,競馬,A5
追体験オグリキャップ2(89年編),ドラゴニア,ドラゴニア,2022/12/31,競馬,A5
追体験オグリキャップ3(90年編),ドラゴニア,ドラゴニア,2022/12/31,競馬,A5
マンガヨミアルキVol.2 東海編,マンガニウム,さしみ,2018/11/25,古書店,B5
機動戦士ガンダム逆襲のシャア 友の会 復刻版 ペーパー付,カラー,庵野秀明,2023/1/16,評論,B5
エロマンガベスト100,夜話.zip,新野安,2021/1/24,評論,A5
